### ISSUE TITLE
server push fails on ppc64le and aarm64

### ISSUE THREAD

**Issue by uhliarik** [icing/mod_h2#146]
Hi,
I tried to configure simple test with mod_h2, configuration is following:

```
Protocols h2 h2c http/1.1
<Location /http2.html>
    Header add Link "</fake.jpg>;rel=preload"
</Location>
```

HTTP2 file looks like:
```
<html>
  <head>
    <title>HTTP/2 Test</title>
  </head>
  <body>
    <img src="fake.jpg">
  </body>
</html>
```

fake.jpg is following:
```
This is a fake JPEG
```

On x86_64 everything works as expected, but on aarm64 and ppc64le this test fails. I'm downloading testing page http2.html with command curl --http2 -v localhost/http2.html. I also collected trace8 output of working test on x86_64 and trace8 of non-working test on ppc64_le. I will paste them separately in posts in this thread.

**Comment by uhliarik** [comment]
This is tcp dump + trace8 of working test:

tcp dump:
```
07:12:41.842896 IP localhost.53060 > localhost.http: Flags [P.], seq 3378410566:3378410734, ack 3131572853, win 342, options [nop,nop,TS val 20909910 ecr 20909909], length 168: HTTP: GET /http2.html HTTP/1.1
E...{.@.@............D.P.^tF...u...V.......
.?.V.?.UGET /http2.html HTTP/1.1
Host: 127.0.0.1
User-Agent: curl/7.47.1
Accept: */*
Connection: Upgrade, HTTP2-Settings
Upgrade: h2c
HTTP2-Settings: AAMAAABkAAQAAP__

................
07:12:41.843536 IP localhost.http > localhost.53060: Flags [P.], seq 1:72, ack 168, win 350, options [nop,nop,TS val 20909910 ecr 20909910], length 71: HTTP: HTTP/1.1 101 Switching Protocols
E..{.$@.@./W.........P.D...u.^t....^.o.....
.?.V.?.VHTTP/1.1 101 Switching Protocols
Upgrade: h2c
Connection: Upgrade

................
07:12:41.843748 IP localhost.53060 > localhost.http: Flags [P.], seq 168:192, ack 72, win 342, options [nop,nop,TS val 20909911 ecr 20909910], length 24: HTTP
E..L{.@.@............D.P.^t........V.@.....
.?.W.?.VPRI * HTTP/2.0

SM

................
07:12:41.843759 IP localhost.http > localhost.53060: Flags [P.], seq 72:100, ack 168, win 350, options [nop,nop,TS val 20909911 ecr 20909910], length 28: HTTP
E..P.%@.@./..........P.D.....^t....^.D.....
.?.W.?.V..............d.............................
07:12:41.843770 IP localhost.53060 > localhost.http: Flags [P.], seq 192:213, ack 72, win 342, options [nop,nop,TS val 20909911 ecr 20909910], length 21: HTTP
E..I{.@.@............D.P.^u........V.=.....
.?.W.?.V..............d......................
07:12:41.843813 IP localhost.53060 > localhost.http: Flags [P.], seq 213:222, ack 100, win 342, options [nop,nop,TS val 20909911 ecr 20909911], length 9: HTTP
E..={.@.@............D.P.^u........V.1.....
.?.W.?.W.........................
07:12:41.843858 IP localhost.http > localhost.53060: Flags [P.], seq 100:109, ack 222, win 350, options [nop,nop,TS val 20909911 ecr 20909911], length 9: HTTP
E..=.'@.@./..........P.D.....^u$...^.1.....
.?.W.?.W.........................
07:12:41.844283 IP localhost.http > localhost.53060: Flags [P.], seq 109:462, ack 222, win 350, options [nop,nop,TS val 20909911 ecr 20909911], length 353: HTTP
E....(@.@..9.........P.D.....^u$...^.......
.?.W.?.W..0...........A...\..p...bQ.*.+..z.%.P.....S.*/*f...\..p...........a..m_J.
e.J...@...p.S...v....r.%.\N..m,.c...)<.....R.....l..Y>.d
Cl...u@..Eq.T...........6.....t.t..R...J......m......U.W7...Z ...q._.I|...M.j.q........@...N.g...........m......<html>
  <head>
    <title>HTTP/2 Test</title>
  </head>
  <body>
    <img src="fake.jpg">
  </body>
</html>
................
07:12:41.844422 IP localhost.53060 > localhost.http: Flags [P.], seq 222:235, ack 462, win 350, options [nop,nop,TS val 20909911 ecr 20909911], length 13: HTTP
E..A{.@.@............D.P.^u$...B...^.5.....
.?.W.?.W.............Switching Protoc
07:12:41.844525 IP localhost.http > localhost.53060: Flags [P.], seq 462:475, ack 235, win 350, options [nop,nop,TS val 20909911 ecr 20909911], length 13: HTTP
E..A.)@.@./..........P.D...B.^u1...^.5.....
.?.W.?.W.............0

SM

.....
```

trace8 output:
```[Wed Aug 30 07:56:04.944143 2017] [http2:trace3] [pid 527:tid 140005713815744] h2_conn.c(145): h2_workers: min=25 max=37, mthrpchild=25, idle_secs=600
[Wed Aug 30 07:56:05.051055 2017] [http2:trace1] [pid 527:tid 140004936353536] h2_h2.c(591): [client 127.0.0.1:39984] h2_h2, process_conn
[Wed Aug 30 07:56:05.051094 2017] [http2:trace1] [pid 527:tid 140004936353536] h2_h2.c(605): [client 127.0.0.1:39984] h2_h2, process_conn, new connection using protocol 'http/1.1', direct=1, tls acceptable=1
[Wed Aug 30 07:56:05.051121 2017] [http2:trace2] [pid 527:tid 140004936353536] h2_h2.c(642): [client 127.0.0.1:39984] h2_h2, not detected in 24 bytes: GET /http2.html HTTP/1.1
[Wed Aug 30 07:56:05.051126 2017] [http2:trace1] [pid 527:tid 140004936353536] h2_h2.c(662): [client 127.0.0.1:39984] h2_h2, declined
[Wed Aug 30 07:56:05.051333 2017] [http2:trace1] [pid 527:tid 140004936353536] h2_switch.c(117): [client 127.0.0.1:39984] proposing protocol 'h2c'
[Wed Aug 30 07:56:05.051387 2017] [http2:trace1] [pid 527:tid 140004936353536] h2_switch.c(150): [client 127.0.0.1:39984] switching protocol to 'h2c'
[Wed Aug 30 07:56:05.051409 2017] [http2:trace4] [pid 527:tid 140004936353536] h2_conn_io.c(155): [client 127.0.0.1:39984] h2_conn_io(135): init, buffering=0, warmup_size=0, cd_secs=0.000000
[Wed Aug 30 07:56:05.051431 2017] [http2:debug] [pid 527:tid 140004936353536] h2_session.c(877): [client 127.0.0.1:39984] AH03200: h2_session(135,INIT,0): created, max_streams=100, stream_mem=32768, workers_limit=6, workers_max=37, push_diary(type=1,N=256)
[Wed Aug 30 07:56:05.051437 2017] [http2:trace3] [pid 527:tid 140004936353536] h2_session.c(1992): [client 127.0.0.1:39984] h2_session(135,INIT,0): process start, async=1
[Wed Aug 30 07:56:05.051444 2017] [http2:debug] [pid 527:tid 140004936353536] h2_session.c(928): [client 127.0.0.1:39984] AH03070: upgrading h2c session with HTTP2-Settings: AAMAAABkAAQAAP__ ->  0  3  0  0  0 64  0  4  0  0 ff ff  (12)
[Wed Aug 30 07:56:05.051451 2017] [http2:debug] [pid 527:tid 140004936353536] h2_session.c(339): [client 127.0.0.1:39984] AH03066: h2_session(135,INIT,0): recv FRAME[SETTINGS[length=12, stream=0]], frames=0/0 (r/s)
[Wed Aug 30 07:56:05.051454 2017] [http2:trace2] [pid 527:tid 140004936353536] h2_session.c(411): [client 127.0.0.1:39984] h2_session(135,INIT,0): on_frame_rcv SETTINGS[length=12, stream=0]
[Wed Aug 30 07:56:05.051459 2017] [http2:debug] [pid 527:tid 140004936353536] h2_stream.c(547): [client 127.0.0.1:39984] AH03082: h2_stream(135-1,IDLE): created
[Wed Aug 30 07:56:05.051461 2017] [http2:trace2] [pid 527:tid 140004936353536] h2_session.c(1850): [client 127.0.0.1:39984] h2_stream(135-1,IDLE): entered state
[Wed Aug 30 07:56:05.051469 2017] [http2:debug] [pid 527:tid 140004936353536] h2_stream.c(637): [client 127.0.0.1:39984] AH03058: h2_stream(135-1,IDLE): set_request_rec GET host=http://127.0.0.1/http2.html
[Wed Aug 30 07:56:05.051472 2017] [http2:trace1] [pid 527:tid 140004936353536] h2_stream.c(300): [client 127.0.0.1:39984] h2_stream(135-1,IDLE): transit to [OPEN]
[Wed Aug 30 07:56:05.051474 2017] [http2:trace2] [pid 527:tid 140004936353536] h2_session.c(1850): [client 127.0.0.1:39984] h2_stream(135-1,OPEN): entered state
[Wed Aug 30 07:56:05.051476 2017] [http2:trace1] [pid 527:tid 140004936353536] h2_stream.c(300): [client 127.0.0.1:39984] h2_stream(135-1,OPEN): transit to [HALF_CLOSED_REMOTE]
[Wed Aug 30 07:56:05.051482 2017] [http2:trace1] [pid 527:tid 140004936353536] h2_stream.c(210): [client 127.0.0.1:39984] h2_stream(135-1,HALF_CLOSED_REMOTE): closing input
[Wed Aug 30 07:56:05.051483 2017] [http2:trace2] [pid 527:tid 140004936353536] h2_session.c(1850): [client 127.0.0.1:39984] h2_stream(135-1,HALF_CLOSED_REMOTE): entered state
[Wed Aug 30 07:56:05.051484 2017] [http2:debug] [pid 527:tid 140004936353536] h2_session.c(970): [client 127.0.0.1:39984] AH03201: h2_session(135,INIT,1): start, INITIAL_WINDOW_SIZE=65535, MAX_CONCURRENT_STREAMS=100
[Wed Aug 30 07:56:05.051488 2017] [http2:debug] [pid 527:tid 140004936353536] h2_session.c(2023): [client 127.0.0.1:39984] AH03079: h2_session(135,INIT,1): started on qeos-180.lab.eng.rdu2.redhat.com:80
[Wed Aug 30 07:56:05.051489 2017] [http2:debug] [pid 527:tid 140004936353536] h2_session.c(1612): [client 127.0.0.1:39984] AH03078: h2_session(135,INIT,1): transit [INIT] -- init --> [BUSY]
[Wed Aug 30 07:56:05.051492 2017] [http2:trace1] [pid 527:tid 140004936353536] h2_filter.c(144): [client 127.0.0.1:39984] h2_session(135): read, NONBLOCK_READ, mode=0, readbytes=65536
[Wed Aug 30 07:56:05.051500 2017] [http2:trace2] [pid 527:tid 140004936353536] h2_filter.c(92): [client 127.0.0.1:39984] bb_dump(135): RAW_in()
[Wed Aug 30 07:56:05.051503 2017] [http2:trace1] [pid 527:tid 140004936353536] h2_stream.c(599): [client 127.0.0.1:39984] h2_stream(135-1,HALF_CLOSED_REMOTE): schedule GET http://127.0.0.1/http2.html chunked=0
[Wed Aug 30 07:56:05.051510 2017] [http2:trace1] [pid 527:tid 140004936353536] h2_mplx.c(697): [client 127.0.0.1:39984] h2_stream(135-1,HALF_CLOSED_REMOTE): process, added to q
[Wed Aug 30 07:56:05.051512 2017] [http2:trace2] [pid 527:tid 140004936353536] h2_mplx.c(1239): [client 127.0.0.1:39984] h2_mplx(135): dispatch events
[Wed Aug 30 07:56:05.051529 2017] [http2:debug] [pid 527:tid 140004936353536] h2_session.c(543): [client 127.0.0.1:39984] AH03068: h2_session(135,BUSY,1): sent FRAME[SETTINGS[length=6, stream=0]], frames=1/1 (r/s)
[Wed Aug 30 07:56:05.051532 2017] [http2:debug] [pid 527:tid 140004936353536] h2_session.c(543): [client 127.0.0.1:39984] AH03068: h2_session(135,BUSY,1): sent FRAME[WINDOW_UPDATE[stream=0, incr=2147418112]], frames=1/2 (r/s)
[Wed Aug 30 07:56:05.051548 2017] [http2:trace2] [pid 527:tid 140004936353536] h2_conn_io.c(121): [client 127.0.0.1:39984] h2_session(135)-out: heap[28] flush 
[Wed Aug 30 07:56:05.051567 2017] [http2:trace1] [pid 527:tid 140004936353536] h2_filter.c(144): [client 127.0.0.1:39984] h2_session(135): read, NONBLOCK_READ, mode=0, readbytes=65536
[Wed Aug 30 07:56:05.051571 2017] [http2:trace2] [pid 527:tid 140004936353536] h2_filter.c(92): [client 127.0.0.1:39984] bb_dump(135): RAW_in()
[Wed Aug 30 07:56:05.051572 2017] [http2:trace2] [pid 527:tid 140004936353536] h2_mplx.c(1239): [client 127.0.0.1:39984] h2_mplx(135): dispatch events
[Wed Aug 30 07:56:05.051574 2017] [http2:trace2] [pid 527:tid 140004936353536] h2_session.c(1711): [client 127.0.0.1:39984] h2_session(135,BUSY,1): NO_IO event, 1 streams open
[Wed Aug 30 07:56:05.051575 2017] [http2:trace1] [pid 527:tid 140004936353536] h2_session.c(1612): [client 127.0.0.1:39984] AH03078: h2_session(135,BUSY,1): transit [BUSY] -- no io --> [WAIT]
[Wed Aug 30 07:56:05.051577 2017] [http2:trace3] [pid 527:tid 140004936353536] h2_session.c(2211): [client 127.0.0.1:39984] h2_session: wait for data, 10 micros
[Wed Aug 30 07:56:05.051594 2017] [http2:trace3] [pid 527:tid 140005318735616] h2_conn.c(282): [client 127.0.0.1:39984] h2_stream(135-1): create slave
[Wed Aug 30 07:56:05.051609 2017] [http2:trace2] [pid 527:tid 140005318735616] h2_conn.c(349): [client 127.0.0.1:39984] h2_stream(135-1): created slave
[Wed Aug 30 07:56:05.051616 2017] [http2:trace2] [pid 527:tid 140005318735616] h2_task.c(491): [client 127.0.0.1:39984] h2_h2, pre_connection, found stream task
[Wed Aug 30 07:56:05.051634 2017] [http2:trace1] [pid 527:tid 140005318735616] h2_task.c(620): [client 127.0.0.1:39984] h2_task(135-1): process connection
[Wed Aug 30 07:56:05.051638 2017] [http2:trace1] [pid 527:tid 140005318735616] h2_task.c(712): [client 127.0.0.1:39984] h2_h2, processing request directly
[Wed Aug 30 07:56:05.051648 2017] [http2:trace1] [pid 527:tid 140005318735616] h2_task.c(646): [client 127.0.0.1:39984] h2_task(135-1): create request_rec
[Wed Aug 30 07:56:05.051657 2017] [http2:trace3] [pid 527:tid 140005318735616] h2_h2.c(722): [client 127.0.0.1:39984] h2_task(135-1): adding request filters
[Wed Aug 30 07:56:05.051676 2017] [http2:trace1] [pid 527:tid 140005318735616] h2_task.c(664): [client 127.0.0.1:39984] h2_task(135-1): start process_request
[Wed Aug 30 07:56:05.051753 2017] [http2:trace1] [pid 527:tid 140005318735616] h2_from_h1.c(525): [client 127.0.0.1:39984] h2_task(135-1): output_filter called
[Wed Aug 30 07:56:05.051765 2017] [http2:trace2] [pid 527:tid 140005318735616] h2_task.c(61): [client 127.0.0.1:39984] bb_dump(135-1): h2_task send_out(H2HEADERS FILE[109] EOS)
[Wed Aug 30 07:56:05.051769 2017] [http2:trace2] [pid 527:tid 140005318735616] h2_bucket_beam.c(1275): [client 127.0.0.1:39984] beam(135-1,output,closed=0,aborted=0,empty=1,buf=0): send_out(before)
[Wed Aug 30 07:56:05.051777 2017] [http2:trace2] [pid 527:tid 140005318735616] h2_bucket_beam.c(1275): [client 127.0.0.1:39984] beam(135-1,output,closed=1,aborted=0,empty=0,buf=109): send_out(after)
[Wed Aug 30 07:56:05.051779 2017] [http2:trace2] [pid 527:tid 140005318735616] h2_task.c(114): [client 127.0.0.1:39984] h2_task(135-1): send_out done
[Wed Aug 30 07:56:05.051780 2017] [http2:trace2] [pid 527:tid 140005318735616] h2_task.c(193): [client 127.0.0.1:39984] h2_slave_out(135-1): slave_out leave
[Wed Aug 30 07:56:05.051784 2017] [http2:trace2] [pid 527:tid 140005318735616] h2_task.c(61): [client 127.0.0.1:39984] bb_dump(135-1): h2_task send_out(EOR)
[Wed Aug 30 07:56:05.051786 2017] [http2:trace2] [pid 527:tid 140005318735616] h2_bucket_beam.c(1275): [client 127.0.0.1:39984] beam(135-1,output,closed=1,aborted=0,empty=0,buf=109): send_out(before)
[Wed Aug 30 07:56:05.051787 2017] [http2:trace2] [pid 527:tid 140005318735616] h2_bucket_beam.c(1275): [client 127.0.0.1:39984] beam(135-1,output,closed=1,aborted=0,empty=0,buf=109): send_out(after)
[Wed Aug 30 07:56:05.051789 2017] [http2:trace2] [pid 527:tid 140005318735616] h2_task.c(114): [client 127.0.0.1:39984] h2_task(135-1): send_out done
[Wed Aug 30 07:56:05.051797 2017] [http2:trace2] [pid 527:tid 140005318735616] h2_task.c(193): [client 127.0.0.1:39984] h2_slave_out(135-1): slave_out leave
[Wed Aug 30 07:56:05.051799 2017] [http2:trace1] [pid 527:tid 140005318735616] h2_task.c(229): [client 127.0.0.1:39984] h2_slave_in(135-1): read, mode=3, block=1, readbytes=1
[Wed Aug 30 07:56:05.051800 2017] [http2:trace1] [pid 527:tid 140005318735616] h2_task.c(259): [client 127.0.0.1:39984] h2_slave_in(135-1): get more data from mplx, block=1, readbytes=1
[Wed Aug 30 07:56:05.051802 2017] [http2:trace2] [pid 527:tid 140005318735616] h2_task.c(271): (70014)End of file found: [client 127.0.0.1:39984] h2_slave_in(135-1): read returned
[Wed Aug 30 07:56:05.051806 2017] [http2:trace2] [pid 527:tid 140005318735616] h2_task.c(61): [client 127.0.0.1:39984] bb_dump(135-1): h2_task send_out(FLUSH)
[Wed Aug 30 07:56:05.051808 2017] [http2:trace2] [pid 527:tid 140005318735616] h2_bucket_beam.c(1275): [client 127.0.0.1:39984] beam(135-1,output,closed=1,aborted=0,empty=0,buf=109): send_out(before)
[Wed Aug 30 07:56:05.051809 2017] [http2:trace2] [pid 527:tid 140005318735616] h2_bucket_beam.c(1275): [client 127.0.0.1:39984] beam(135-1,output,closed=1,aborted=0,empty=0,buf=109): send_out(after)
[Wed Aug 30 07:56:05.051811 2017] [http2:trace2] [pid 527:tid 140005318735616] h2_task.c(114): [client 127.0.0.1:39984] h2_task(135-1): send_out done
[Wed Aug 30 07:56:05.051813 2017] [http2:debug] [pid 527:tid 140005318735616] h2_task.c(86): [client 127.0.0.1:39984] AH03348: h2_task(135-1): open output to GET 127.0.0.1 /http2.html
[Wed Aug 30 07:56:05.051815 2017] [http2:trace2] [pid 527:tid 140005318735616] h2_bucket_beam.c(1275): [client 127.0.0.1:39984] beam(135-1,output,closed=1,aborted=0,empty=0,buf=109): out_open
[Wed Aug 30 07:56:05.051861 2017] [http2:trace2] [pid 527:tid 140005318735616] h2_task.c(193): [client 127.0.0.1:39984] h2_slave_out(135-1): slave_out leave
[Wed Aug 30 07:56:05.051865 2017] [http2:trace1] [pid 527:tid 140005318735616] h2_task.c(673): [client 127.0.0.1:39984] h2_task(135-1): process_request done
[Wed Aug 30 07:56:05.051867 2017] [http2:trace1] [pid 527:tid 140005318735616] h2_task.c(634): [client 127.0.0.1:39984] h2_task(135-1): processing done
[Wed Aug 30 07:56:05.051869 2017] [http2:trace1] [pid 527:tid 140005318735616] h2_mplx.c(792): [client 127.0.0.1:39984] h2_mplx(135): task(135-1) done
[Wed Aug 30 07:56:05.051871 2017] [http2:trace2] [pid 527:tid 140005318735616] h2_mplx.c(590): [client 127.0.0.1:39984] h2_mplx(135-1): close
[Wed Aug 30 07:56:05.051873 2017] [http2:trace2] [pid 527:tid 140005318735616] h2_bucket_beam.c(1275): [client 127.0.0.1:39984] beam(135-1,output,closed=1,aborted=0,empty=0,buf=109): out_close
[Wed Aug 30 07:56:05.051876 2017] [http2:trace2] [pid 527:tid 140005318735616] h2_mplx.c(823): [client 127.0.0.1:39984] h2_mplx(135-1): request done, 0.264000 ms elapsed
[Wed Aug 30 07:56:05.051878 2017] [http2:trace2] [pid 527:tid 140005318735616] h2_mplx.c(853): [client 127.0.0.1:39984] h2_stream(135-1,HALF_CLOSED_REMOTE): task_done, stream open
[Wed Aug 30 07:56:05.051986 2017] [http2:trace2] [pid 527:tid 140004936353536] h2_mplx.c(619): [client 127.0.0.1:39984] h2_mplx(135): trywait on data for 0.010000 ms)
[Wed Aug 30 07:56:05.052004 2017] [http2:trace1] [pid 527:tid 140004936353536] h2_session.c(1612): [client 127.0.0.1:39984] AH03078: h2_session(135,WAIT,1): transit [WAIT] -- data read --> [BUSY]
[Wed Aug 30 07:56:05.052006 2017] [http2:trace1] [pid 527:tid 140004936353536] h2_filter.c(144): [client 127.0.0.1:39984] h2_session(135): read, NONBLOCK_READ, mode=0, readbytes=65536
[Wed Aug 30 07:56:05.052011 2017] [http2:trace2] [pid 527:tid 140004936353536] h2_filter.c(92): [client 127.0.0.1:39984] bb_dump(135): RAW_in()
[Wed Aug 30 07:56:05.052013 2017] [http2:trace2] [pid 527:tid 140004936353536] h2_mplx.c(1239): [client 127.0.0.1:39984] h2_mplx(135): dispatch events
[Wed Aug 30 07:56:05.052015 2017] [http2:trace2] [pid 527:tid 140004936353536] h2_session.c(1433): [client 127.0.0.1:39984] h2_stream(135-1,HALF_CLOSED_REMOTE): on_resume
[Wed Aug 30 07:56:05.052018 2017] [http2:trace2] [pid 527:tid 140004936353536] h2_stream.c(180): [client 127.0.0.1:39984] h2_stream(135-1,HALF_CLOSED_REMOTE): out-buffer(add_data())
[Wed Aug 30 07:56:05.052019 2017] [http2:trace2] [pid 527:tid 140004936353536] h2_stream.c(180): [client 127.0.0.1:39984] h2_stream(135-1,HALF_CLOSED_REMOTE): out-buffer(pre())
[Wed Aug 30 07:56:05.052025 2017] [http2:trace2] [pid 527:tid 140004936353536] h2_stream.c(180): [client 127.0.0.1:39984] h2_stream(135-1,HALF_CLOSED_REMOTE): out-buffer(post(H2HEADERS FILE[109] EOS FLUSH))
[Wed Aug 30 07:56:05.052029 2017] [http2:trace2] [pid 527:tid 140004936353536] h2_stream.c(180): [client 127.0.0.1:39984] h2_stream(135-1,HALF_CLOSED_REMOTE): out-buffer(add_data(H2HEADERS FILE[109] EOS FLUSH))
[Wed Aug 30 07:56:05.052031 2017] [http2:trace1] [pid 527:tid 140004936353536] h2_stream.c(814): [client 127.0.0.1:39984] h2_stream(135-1,HALF_CLOSED_REMOTE): prep, -> response 200
[Wed Aug 30 07:56:05.052032 2017] [http2:trace1] [pid 527:tid 140004936353536] h2_stream.c(919): [client 127.0.0.1:39984] h2_stream(135-1,HALF_CLOSED_REMOTE): prepare, no data
[Wed Aug 30 07:56:05.052034 2017] [http2:trace2] [pid 527:tid 140004936353536] h2_session.c(1440): (11)Resource temporarily unavailable: [client 127.0.0.1:39984] h2_stream(135-1,HALF_CLOSED_REMOTE): prepared len=0, eos=0
[Wed Aug 30 07:56:05.052044 2017] [http2:trace2] [pid 527:tid 140004936353536] h2_session.c(1280): [client 127.0.0.1:39984] h2_stream(135-1,HALF_CLOSED_REMOTE): on_headers
[Wed Aug 30 07:56:05.052046 2017] [http2:debug] [pid 527:tid 140004936353536] h2_session.c(1312): [client 127.0.0.1:39984] AH03073: h2_stream(135-1,HALF_CLOSED_REMOTE): submit response 200, REMOTE_WINDOW_SIZE=65535
[Wed Aug 30 07:56:05.052067 2017] [http2:trace1] [pid 527:tid 140004936353536] h2_push.c(677): [client 127.0.0.1:39984] push_diary_update: adding PUSH /fake.jpg
[Wed Aug 30 07:56:05.052070 2017] [http2:trace1] [pid 527:tid 140004936353536] h2_stream.c(960): [client 127.0.0.1:39984] h2_stream(135-1,HALF_CLOSED_REMOTE): found 1 push candidates
[Wed Aug 30 07:56:05.052077 2017] [http2:debug] [pid 527:tid 140004936353536] h2_session.c(1103): [client 127.0.0.1:39984] AH03076: h2_stream(135-1,HALF_CLOSED_REMOTE): SERVER_PUSH 2 for GET /fake.jpg on 1
[Wed Aug 30 07:56:05.052082 2017] [http2:debug] [pid 527:tid 140004936353536] h2_stream.c(547): [client 127.0.0.1:39984] AH03082: h2_stream(135-2,IDLE): created
[Wed Aug 30 07:56:05.052083 2017] [http2:trace2] [pid 527:tid 140004936353536] h2_session.c(1850): [client 127.0.0.1:39984] h2_stream(135-2,IDLE): entered state
[Wed Aug 30 07:56:05.052101 2017] [http2:debug] [pid 527:tid 140004936353536] h2_session.c(543): [client 127.0.0.1:39984] AH03068: h2_session(135,BUSY,2): sent FRAME[PUSH_PROMISE[length=48, hend=1, stream=1]], frames=1/3 (r/s)
[Wed Aug 30 07:56:05.052104 2017] [http2:trace1] [pid 527:tid 140004936353536] h2_stream.c(410): [client 127.0.0.1:39984] h2_stream(135-2,IDLE): send frame 5, eos=0
[Wed Aug 30 07:56:05.052105 2017] [http2:trace1] [pid 527:tid 140004936353536] h2_stream.c(300): [client 127.0.0.1:39984] h2_stream(135-2,IDLE): transit to [RESERVED_LOCAL]
[Wed Aug 30 07:56:05.052107 2017] [http2:trace1] [pid 527:tid 140004936353536] h2_stream.c(210): [client 127.0.0.1:39984] h2_stream(135-2,RESERVED_LOCAL): closing input
[Wed Aug 30 07:56:05.052108 2017] [http2:trace2] [pid 527:tid 140004936353536] h2_session.c(1850): [client 127.0.0.1:39984] h2_stream(135-2,RESERVED_LOCAL): entered state
[Wed Aug 30 07:56:05.052117 2017] [http2:debug] [pid 527:tid 140004936353536] h2_session.c(543): [client 127.0.0.1:39984] AH03068: h2_session(135,BUSY,2): sent FRAME[HEADERS[length=169, hend=1, stream=1, eos=0]], frames=1/4 (r/s)
[Wed Aug 30 07:56:05.052119 2017] [http2:trace1] [pid 527:tid 140004936353536] h2_stream.c(410): [client 127.0.0.1:39984] h2_stream(135-1,HALF_CLOSED_REMOTE): send frame 1, eos=0
[Wed Aug 30 07:56:05.052123 2017] [http2:trace2] [pid 527:tid 140004936353536] h2_stream.c(180): [client 127.0.0.1:39984] h2_stream(135-1,HALF_CLOSED_REMOTE): out-buffer(add_data(FILE[109] EOS FLUSH))
[Wed Aug 30 07:56:05.052124 2017] [http2:trace1] [pid 527:tid 140004936353536] h2_stream.c(914): [client 127.0.0.1:39984] h2_stream(135-1,HALF_CLOSED_REMOTE): prepare, len=109 eos=1
[Wed Aug 30 07:56:05.052126 2017] [http2:trace2] [pid 527:tid 140004936353536] h2_session.c(1045): [client 127.0.0.1:39984] h2_stream(135-1,HALF_CLOSED_REMOTE): prepared no_copy, len=109, eos=1
[Wed Aug 30 07:56:05.052128 2017] [http2:trace2] [pid 527:tid 140004936353536] h2_session.c(468): [client 127.0.0.1:39984] h2_stream(135-1,HALF_CLOSED_REMOTE): send_data_cb for 109 bytes
[Wed Aug 30 07:56:05.052130 2017] [http2:trace2] [pid 527:tid 140004936353536] h2_stream.c(945): [client 127.0.0.1:39984] h2_stream(135-1,HALF_CLOSED_REMOTE): read_to, len=109 eos=1
[Wed Aug 30 07:56:05.052132 2017] [http2:debug] [pid 527:tid 140004936353536] h2_session.c(543): [client 127.0.0.1:39984] AH03068: h2_session(135,BUSY,2): sent FRAME[DATA[length=109, flags=1, stream=1, padlen=0]], frames=1/5 (r/s)
[Wed Aug 30 07:56:05.052133 2017] [http2:trace1] [pid 527:tid 140004936353536] h2_stream.c(410): [client 127.0.0.1:39984] h2_stream(135-1,HALF_CLOSED_REMOTE): send frame 0, eos=1
[Wed Aug 30 07:56:05.052135 2017] [http2:trace1] [pid 527:tid 140004936353536] h2_stream.c(300): [client 127.0.0.1:39984] h2_stream(135-1,HALF_CLOSED_REMOTE): transit to [CLOSED]
[Wed Aug 30 07:56:05.052136 2017] [http2:trace1] [pid 527:tid 140004936353536] h2_stream.c(210): [client 127.0.0.1:39984] h2_stream(135-1,CLOSED): closing input
[Wed Aug 30 07:56:05.052137 2017] [http2:trace2] [pid 527:tid 140004936353536] h2_session.c(1850): [client 127.0.0.1:39984] h2_stream(135-1,CLOSED): entered state
[Wed Aug 30 07:56:05.052143 2017] [http2:trace2] [pid 527:tid 140004936353536] h2_stream.c(180): [client 127.0.0.1:39984] h2_stream(135-1,CLOSED): out-buffer(add_data())
[Wed Aug 30 07:56:05.052144 2017] [http2:trace2] [pid 527:tid 140004936353536] h2_stream.c(180): [client 127.0.0.1:39984] h2_stream(135-1,CLOSED): out-buffer(pre())
[Wed Aug 30 07:56:05.052146 2017] [http2:trace2] [pid 527:tid 140004936353536] h2_stream.c(180): [client 127.0.0.1:39984] h2_stream(135-1,CLOSED): out-buffer(post())
[Wed Aug 30 07:56:05.052147 2017] [http2:trace1] [pid 527:tid 140004936353536] h2_stream.c(914): [client 127.0.0.1:39984] h2_stream(135-1,CLOSED): prepare, len=0 eos=1
[Wed Aug 30 07:56:05.052149 2017] [http2:trace2] [pid 527:tid 140004936353536] h2_session.c(1440): [client 127.0.0.1:39984] h2_stream(135-1,CLOSED): prepared len=0, eos=1
[Wed Aug 30 07:56:05.052150 2017] [http2:debug] [pid 527:tid 140004936353536] h2_session.c(1462): [client 127.0.0.1:39984] AH02936: h2_stream(135-1,CLOSED): resumed
[Wed Aug 30 07:56:05.052152 2017] [http2:trace1] [pid 527:tid 140004936353536] h2_filter.c(144): [client 127.0.0.1:39984] h2_session(135): read, NONBLOCK_READ, mode=0, readbytes=65536
[Wed Aug 30 07:56:05.052156 2017] [http2:trace2] [pid 527:tid 140004936353536] h2_filter.c(92): [client 127.0.0.1:39984] bb_dump(135): RAW_in()
[Wed Aug 30 07:56:05.052157 2017] [http2:trace1] [pid 527:tid 140004936353536] h2_stream.c(599): [client 127.0.0.1:39984] h2_stream(135-2,RESERVED_LOCAL): schedule GET http://127.0.0.1/fake.jpg chunked=0
[Wed Aug 30 07:56:05.052162 2017] [http2:trace1] [pid 527:tid 140004936353536] h2_mplx.c(697): [client 127.0.0.1:39984] h2_stream(135-2,RESERVED_LOCAL): process, added to q
[Wed Aug 30 07:56:05.052164 2017] [http2:trace2] [pid 527:tid 140004936353536] h2_mplx.c(1239): [client 127.0.0.1:39984] h2_mplx(135): dispatch events
[Wed Aug 30 07:56:05.052166 2017] [http2:trace2] [pid 527:tid 140004936353536] h2_session.c(1711): [client 127.0.0.1:39984] h2_session(135,BUSY,1): NO_IO event, 1 streams open
[Wed Aug 30 07:56:05.052168 2017] [http2:trace2] [pid 527:tid 140004936353536] h2_conn_io.c(121): [client 127.0.0.1:39984] h2_session(135)-out: heap[244] file[109] flush h2eos flush 
[Wed Aug 30 07:56:05.052195 2017] [http2:trace2] [pid 527:tid 140004936353536] h2_stream.c(342): [client 127.0.0.1:39984] h2_stream(135-1,CLOSED): dispatch event 3
[Wed Aug 30 07:56:05.052198 2017] [http2:trace1] [pid 527:tid 140004936353536] h2_stream.c(300): [client 127.0.0.1:39984] h2_stream(135-1,CLOSED): transit to [CLEANUP]
[Wed Aug 30 07:56:05.052199 2017] [http2:trace2] [pid 527:tid 140004936353536] h2_session.c(1850): [client 127.0.0.1:39984] h2_stream(135-1,CLEANUP): entered state
[Wed Aug 30 07:56:05.052201 2017] [http2:trace2] [pid 527:tid 140004936353536] h2_mplx.c(493): [client 127.0.0.1:39984] h2_stream(135-1,CLEANUP): cleanup
[Wed Aug 30 07:56:05.052204 2017] [http2:trace1] [pid 527:tid 140004936353536] h2_session.c(1612): [client 127.0.0.1:39984] AH03078: h2_session(135,BUSY,1): transit [BUSY] -- no io --> [WAIT]
[Wed Aug 30 07:56:05.052206 2017] [http2:trace3] [pid 527:tid 140004936353536] h2_session.c(2211): [client 127.0.0.1:39984] h2_session: wait for data, 10 micros
[Wed Aug 30 07:56:05.052207 2017] [http2:debug] [pid 527:tid 140004936353536] h2_bucket_beam.c(1275): [client 127.0.0.1:39984] beam(135-1,output,closed=1,aborted=1,empty=1,buf=0): AH03385: h2_task_destroy, reuse slave
[Wed Aug 30 07:56:05.052209 2017] [http2:trace2] [pid 527:tid 140004936353536] h2_bucket_beam.c(1275): [client 127.0.0.1:39984] beam(135-1,output,closed=1,aborted=1,empty=1,buf=0): task_destroy
[Wed Aug 30 07:56:05.052238 2017] [http2:trace3] [pid 527:tid 140004936353536] h2_stream.c(579): [client 127.0.0.1:39984] h2_stream(135-1,CLEANUP): destroy
[Wed Aug 30 07:56:05.052311 2017] [http2:trace2] [pid 527:tid 140005318735616] h2_task.c(491): [client 127.0.0.1:39984] h2_h2, pre_connection, found stream task
[Wed Aug 30 07:56:05.052316 2017] [http2:trace1] [pid 527:tid 140005318735616] h2_task.c(620): [client 127.0.0.1:39984] h2_task(135-2): process connection
[Wed Aug 30 07:56:05.052321 2017] [http2:trace1] [pid 527:tid 140005318735616] h2_task.c(712): [client 127.0.0.1:39984] h2_h2, processing request directly
[Wed Aug 30 07:56:05.052322 2017] [http2:trace1] [pid 527:tid 140005318735616] h2_task.c(646): [client 127.0.0.1:39984] h2_task(135-2): create request_rec
[Wed Aug 30 07:56:05.052329 2017] [http2:trace3] [pid 527:tid 140005318735616] h2_h2.c(722): [client 127.0.0.1:39984] h2_task(135-2): adding request filters
[Wed Aug 30 07:56:05.052333 2017] [http2:trace1] [pid 527:tid 140005318735616] h2_task.c(664): [client 127.0.0.1:39984] h2_task(135-2): start process_request
[Wed Aug 30 07:56:05.052368 2017] [http2:trace1] [pid 527:tid 140005318735616] h2_from_h1.c(525): [client 127.0.0.1:39984] h2_task(135-2): output_filter called
[Wed Aug 30 07:56:05.052385 2017] [http2:trace2] [pid 527:tid 140005318735616] h2_task.c(61): [client 127.0.0.1:39984] bb_dump(135-2): h2_task send_out(H2HEADERS FILE[20] EOS)
[Wed Aug 30 07:56:05.052387 2017] [http2:trace2] [pid 527:tid 140005318735616] h2_bucket_beam.c(1275): [client 127.0.0.1:39984] beam(135-2,output,closed=0,aborted=0,empty=1,buf=0): send_out(before)
[Wed Aug 30 07:56:05.052389 2017] [http2:trace2] [pid 527:tid 140005318735616] h2_bucket_beam.c(1275): [client 127.0.0.1:39984] beam(135-2,output,closed=1,aborted=0,empty=0,buf=20): send_out(after)
[Wed Aug 30 07:56:05.052391 2017] [http2:trace2] [pid 527:tid 140005318735616] h2_task.c(114): [client 127.0.0.1:39984] h2_task(135-2): send_out done
[Wed Aug 30 07:56:05.052392 2017] [http2:trace2] [pid 527:tid 140005318735616] h2_task.c(193): [client 127.0.0.1:39984] h2_slave_out(135-2): slave_out leave
[Wed Aug 30 07:56:05.052394 2017] [http2:trace2] [pid 527:tid 140005318735616] h2_task.c(61): [client 127.0.0.1:39984] bb_dump(135-2): h2_task send_out(EOR)
[Wed Aug 30 07:56:05.052395 2017] [http2:trace2] [pid 527:tid 140005318735616] h2_bucket_beam.c(1275): [client 127.0.0.1:39984] beam(135-2,output,closed=1,aborted=0,empty=0,buf=20): send_out(before)
[Wed Aug 30 07:56:05.052397 2017] [http2:trace2] [pid 527:tid 140005318735616] h2_bucket_beam.c(1275): [client 127.0.0.1:39984] beam(135-2,output,closed=1,aborted=0,empty=0,buf=20): send_out(after)
[Wed Aug 30 07:56:05.052398 2017] [http2:trace2] [pid 527:tid 140005318735616] h2_task.c(114): [client 127.0.0.1:39984] h2_task(135-2): send_out done
[Wed Aug 30 07:56:05.052399 2017] [http2:trace2] [pid 527:tid 140005318735616] h2_task.c(193): [client 127.0.0.1:39984] h2_slave_out(135-2): slave_out leave
[Wed Aug 30 07:56:05.052400 2017] [http2:trace1] [pid 527:tid 140005318735616] h2_task.c(229): [client 127.0.0.1:39984] h2_slave_in(135-2): read, mode=3, block=1, readbytes=1
[Wed Aug 30 07:56:05.052402 2017] [http2:trace1] [pid 527:tid 140005318735616] h2_task.c(259): [client 127.0.0.1:39984] h2_slave_in(135-2): get more data from mplx, block=1, readbytes=1
[Wed Aug 30 07:56:05.052403 2017] [http2:trace2] [pid 527:tid 140005318735616] h2_task.c(271): (70014)End of file found: [client 127.0.0.1:39984] h2_slave_in(135-2): read returned
[Wed Aug 30 07:56:05.052405 2017] [http2:trace2] [pid 527:tid 140005318735616] h2_task.c(61): [client 127.0.0.1:39984] bb_dump(135-2): h2_task send_out(FLUSH)
[Wed Aug 30 07:56:05.052406 2017] [http2:trace2] [pid 527:tid 140005318735616] h2_bucket_beam.c(1275): [client 127.0.0.1:39984] beam(135-2,output,closed=1,aborted=0,empty=0,buf=20): send_out(before)
[Wed Aug 30 07:56:05.052407 2017] [http2:trace2] [pid 527:tid 140005318735616] h2_bucket_beam.c(1275): [client 127.0.0.1:39984] beam(135-2,output,closed=1,aborted=0,empty=0,buf=20): send_out(after)
[Wed Aug 30 07:56:05.052409 2017] [http2:trace2] [pid 527:tid 140005318735616] h2_task.c(114): [client 127.0.0.1:39984] h2_task(135-2): send_out done
[Wed Aug 30 07:56:05.052410 2017] [http2:debug] [pid 527:tid 140005318735616] h2_task.c(86): [client 127.0.0.1:39984] AH03348: h2_task(135-2): open output to GET 127.0.0.1 /fake.jpg
[Wed Aug 30 07:56:05.052411 2017] [http2:trace2] [pid 527:tid 140005318735616] h2_bucket_beam.c(1275): [client 127.0.0.1:39984] beam(135-2,output,closed=1,aborted=0,empty=0,buf=20): out_open
[Wed Aug 30 07:56:05.052417 2017] [http2:trace2] [pid 527:tid 140005318735616] h2_task.c(193): [client 127.0.0.1:39984] h2_slave_out(135-2): slave_out leave
[Wed Aug 30 07:56:05.052418 2017] [http2:trace1] [pid 527:tid 140005318735616] h2_task.c(673): [client 127.0.0.1:39984] h2_task(135-2): process_request done
[Wed Aug 30 07:56:05.052419 2017] [http2:trace1] [pid 527:tid 140005318735616] h2_task.c(634): [client 127.0.0.1:39984] h2_task(135-2): processing done
[Wed Aug 30 07:56:05.052421 2017] [http2:trace1] [pid 527:tid 140005318735616] h2_mplx.c(792): [client 127.0.0.1:39984] h2_mplx(135): task(135-2) done
[Wed Aug 30 07:56:05.052422 2017] [http2:trace2] [pid 527:tid 140005318735616] h2_mplx.c(590): [client 127.0.0.1:39984] h2_mplx(135-2): close
[Wed Aug 30 07:56:05.052423 2017] [http2:trace2] [pid 527:tid 140005318735616] h2_bucket_beam.c(1275): [client 127.0.0.1:39984] beam(135-2,output,closed=1,aborted=0,empty=0,buf=20): out_close
[Wed Aug 30 07:56:05.052424 2017] [http2:trace2] [pid 527:tid 140005318735616] h2_mplx.c(823): [client 127.0.0.1:39984] h2_mplx(135-2): request done, 0.122000 ms elapsed
[Wed Aug 30 07:56:05.052426 2017] [http2:trace2] [pid 527:tid 140005318735616] h2_mplx.c(853): [client 127.0.0.1:39984] h2_stream(135-2,RESERVED_LOCAL): task_done, stream open
[Wed Aug 30 07:56:05.052430 2017] [http2:trace2] [pid 527:tid 140004936353536] h2_mplx.c(619): [client 127.0.0.1:39984] h2_mplx(135): trywait on data for 0.010000 ms)
[Wed Aug 30 07:56:05.052432 2017] [http2:trace1] [pid 527:tid 140004936353536] h2_session.c(1612): [client 127.0.0.1:39984] AH03078: h2_session(135,WAIT,1): transit [WAIT] -- data read --> [BUSY]
[Wed Aug 30 07:56:05.052434 2017] [http2:trace1] [pid 527:tid 140004936353536] h2_filter.c(144): [client 127.0.0.1:39984] h2_session(135): read, NONBLOCK_READ, mode=0, readbytes=65536
[Wed Aug 30 07:56:05.052438 2017] [http2:trace2] [pid 527:tid 140004936353536] h2_filter.c(92): [client 127.0.0.1:39984] bb_dump(135): RAW_in()
[Wed Aug 30 07:56:05.052440 2017] [http2:trace2] [pid 527:tid 140004936353536] h2_mplx.c(1239): [client 127.0.0.1:39984] h2_mplx(135): dispatch events
[Wed Aug 30 07:56:05.052441 2017] [http2:trace2] [pid 527:tid 140004936353536] h2_session.c(1433): [client 127.0.0.1:39984] h2_stream(135-2,RESERVED_LOCAL): on_resume
[Wed Aug 30 07:56:05.052443 2017] [http2:trace2] [pid 527:tid 140004936353536] h2_stream.c(180): [client 127.0.0.1:39984] h2_stream(135-2,RESERVED_LOCAL): out-buffer(add_data())
[Wed Aug 30 07:56:05.052444 2017] [http2:trace2] [pid 527:tid 140004936353536] h2_stream.c(180): [client 127.0.0.1:39984] h2_stream(135-2,RESERVED_LOCAL): out-buffer(pre())
[Wed Aug 30 07:56:05.052447 2017] [http2:trace2] [pid 527:tid 140004936353536] h2_stream.c(180): [client 127.0.0.1:39984] h2_stream(135-2,RESERVED_LOCAL): out-buffer(post(H2HEADERS FILE[20] EOS FLUSH))
[Wed Aug 30 07:56:05.052449 2017] [http2:trace2] [pid 527:tid 140004936353536] h2_stream.c(180): [client 127.0.0.1:39984] h2_stream(135-2,RESERVED_LOCAL): out-buffer(add_data(H2HEADERS FILE[20] EOS FLUSH))
[Wed Aug 30 07:56:05.052450 2017] [http2:trace1] [pid 527:tid 140004936353536] h2_stream.c(814): [client 127.0.0.1:39984] h2_stream(135-2,RESERVED_LOCAL): prep, -> response 200
[Wed Aug 30 07:56:05.052451 2017] [http2:trace1] [pid 527:tid 140004936353536] h2_stream.c(919): [client 127.0.0.1:39984] h2_stream(135-2,RESERVED_LOCAL): prepare, no data
[Wed Aug 30 07:56:05.052452 2017] [http2:trace2] [pid 527:tid 140004936353536] h2_session.c(1440): (11)Resource temporarily unavailable: [client 127.0.0.1:39984] h2_stream(135-2,RESERVED_LOCAL): prepared len=0, eos=0
[Wed Aug 30 07:56:05.052455 2017] [http2:trace2] [pid 527:tid 140004936353536] h2_session.c(1280): [client 127.0.0.1:39984] h2_stream(135-2,RESERVED_LOCAL): on_headers
[Wed Aug 30 07:56:05.052457 2017] [http2:debug] [pid 527:tid 140004936353536] h2_session.c(1312): [client 127.0.0.1:39984] AH03073: h2_stream(135-2,RESERVED_LOCAL): submit response 200, REMOTE_WINDOW_SIZE=65535
[Wed Aug 30 07:56:05.052464 2017] [http2:trace2] [pid 527:tid 140004936353536] h2_stream.c(180): [client 127.0.0.1:39984] h2_stream(135-2,RESERVED_LOCAL): out-buffer(add_data(FILE[20] EOS FLUSH))
[Wed Aug 30 07:56:05.052466 2017] [http2:trace1] [pid 527:tid 140004936353536] h2_stream.c(914): [client 127.0.0.1:39984] h2_stream(135-2,RESERVED_LOCAL): prepare, len=20 eos=1
[Wed Aug 30 07:56:05.052467 2017] [http2:trace2] [pid 527:tid 140004936353536] h2_session.c(1440): [client 127.0.0.1:39984] h2_stream(135-2,RESERVED_LOCAL): prepared len=20, eos=1
[Wed Aug 30 07:56:05.052468 2017] [http2:debug] [pid 527:tid 140004936353536] h2_session.c(1462): [client 127.0.0.1:39984] AH02936: h2_stream(135-2,RESERVED_LOCAL): resumed
[Wed Aug 30 07:56:05.052474 2017] [http2:debug] [pid 527:tid 140004936353536] h2_session.c(543): [client 127.0.0.1:39984] AH03068: h2_session(135,BUSY,1): sent FRAME[HEADERS[length=61, hend=1, stream=2, eos=0]], frames=1/6 (r/s)
[Wed Aug 30 07:56:05.052476 2017] [http2:trace1] [pid 527:tid 140004936353536] h2_stream.c(410): [client 127.0.0.1:39984] h2_stream(135-2,RESERVED_LOCAL): send frame 1, eos=0
[Wed Aug 30 07:56:05.052477 2017] [http2:trace1] [pid 527:tid 140004936353536] h2_stream.c(300): [client 127.0.0.1:39984] h2_stream(135-2,RESERVED_LOCAL): transit to [HALF_CLOSED_REMOTE]
[Wed Aug 30 07:56:05.052478 2017] [http2:trace1] [pid 527:tid 140004936353536] h2_stream.c(210): [client 127.0.0.1:39984] h2_stream(135-2,HALF_CLOSED_REMOTE): closing input
[Wed Aug 30 07:56:05.052479 2017] [http2:trace2] [pid 527:tid 140004936353536] h2_session.c(1850): [client 127.0.0.1:39984] h2_stream(135-2,HALF_CLOSED_REMOTE): entered state
[Wed Aug 30 07:56:05.052482 2017] [http2:trace2] [pid 527:tid 140004936353536] h2_stream.c(180): [client 127.0.0.1:39984] h2_stream(135-2,HALF_CLOSED_REMOTE): out-buffer(add_data(FILE[20] EOS FLUSH))
[Wed Aug 30 07:56:05.052484 2017] [http2:trace1] [pid 527:tid 140004936353536] h2_stream.c(914): [client 127.0.0.1:39984] h2_stream(135-2,HALF_CLOSED_REMOTE): prepare, len=20 eos=1
[Wed Aug 30 07:56:05.052485 2017] [http2:trace2] [pid 527:tid 140004936353536] h2_session.c(1045): [client 127.0.0.1:39984] h2_stream(135-2,HALF_CLOSED_REMOTE): prepared no_copy, len=20, eos=1
[Wed Aug 30 07:56:05.052486 2017] [http2:trace2] [pid 527:tid 140004936353536] h2_session.c(468): [client 127.0.0.1:39984] h2_stream(135-2,HALF_CLOSED_REMOTE): send_data_cb for 20 bytes
[Wed Aug 30 07:56:05.052488 2017] [http2:trace2] [pid 527:tid 140004936353536] h2_stream.c(945): [client 127.0.0.1:39984] h2_stream(135-2,HALF_CLOSED_REMOTE): read_to, len=20 eos=1
[Wed Aug 30 07:56:05.052490 2017] [http2:debug] [pid 527:tid 140004936353536] h2_session.c(543): [client 127.0.0.1:39984] AH03068: h2_session(135,BUSY,1): sent FRAME[DATA[length=20, flags=1, stream=2, padlen=0]], frames=1/7 (r/s)
[Wed Aug 30 07:56:05.052491 2017] [http2:trace1] [pid 527:tid 140004936353536] h2_stream.c(410): [client 127.0.0.1:39984] h2_stream(135-2,HALF_CLOSED_REMOTE): send frame 0, eos=1
[Wed Aug 30 07:56:05.052492 2017] [http2:trace1] [pid 527:tid 140004936353536] h2_stream.c(300): [client 127.0.0.1:39984] h2_stream(135-2,HALF_CLOSED_REMOTE): transit to [CLOSED]
[Wed Aug 30 07:56:05.052493 2017] [http2:trace1] [pid 527:tid 140004936353536] h2_stream.c(210): [client 127.0.0.1:39984] h2_stream(135-2,CLOSED): closing input
[Wed Aug 30 07:56:05.052494 2017] [http2:trace2] [pid 527:tid 140004936353536] h2_session.c(1850): [client 127.0.0.1:39984] h2_stream(135-2,CLOSED): entered state
[Wed Aug 30 07:56:05.052498 2017] [http2:trace2] [pid 527:tid 140004936353536] h2_conn_io.c(121): [client 127.0.0.1:39984] h2_session(135)-out: heap[79] file[20] flush h2eos flush 
[Wed Aug 30 07:56:05.052519 2017] [http2:trace2] [pid 527:tid 140004936353536] h2_stream.c(342): [client 127.0.0.1:39984] h2_stream(135-2,CLOSED): dispatch event 3
[Wed Aug 30 07:56:05.052521 2017] [http2:trace1] [pid 527:tid 140004936353536] h2_stream.c(300): [client 127.0.0.1:39984] h2_stream(135-2,CLOSED): transit to [CLEANUP]
[Wed Aug 30 07:56:05.052522 2017] [http2:trace2] [pid 527:tid 140004936353536] h2_session.c(1850): [client 127.0.0.1:39984] h2_stream(135-2,CLEANUP): entered state
[Wed Aug 30 07:56:05.052526 2017] [http2:trace2] [pid 527:tid 140004936353536] h2_mplx.c(493): [client 127.0.0.1:39984] h2_stream(135-2,CLEANUP): cleanup
[Wed Aug 30 07:56:05.052529 2017] [http2:trace1] [pid 527:tid 140004936353536] h2_filter.c(144): [client 127.0.0.1:39984] h2_session(135): read, NONBLOCK_READ, mode=0, readbytes=65536
[Wed Aug 30 07:56:05.052533 2017] [http2:trace2] [pid 527:tid 140004936353536] h2_filter.c(92): [client 127.0.0.1:39984] bb_dump(135): RAW_in()
[Wed Aug 30 07:56:05.052534 2017] [http2:trace2] [pid 527:tid 140004936353536] h2_mplx.c(1239): [client 127.0.0.1:39984] h2_mplx(135): dispatch events
[Wed Aug 30 07:56:05.052536 2017] [http2:debug] [pid 527:tid 140004936353536] h2_bucket_beam.c(1275): [client 127.0.0.1:39984] beam(135-2,output,closed=1,aborted=1,empty=1,buf=0): AH03385: h2_task_destroy, reuse slave
[Wed Aug 30 07:56:05.052537 2017] [http2:trace2] [pid 527:tid 140004936353536] h2_bucket_beam.c(1275): [client 127.0.0.1:39984] beam(135-2,output,closed=1,aborted=1,empty=1,buf=0): task_destroy
[Wed Aug 30 07:56:05.052551 2017] [http2:trace3] [pid 527:tid 140004936353536] h2_stream.c(579): [client 127.0.0.1:39984] h2_stream(135-2,CLEANUP): destroy
[Wed Aug 30 07:56:05.052555 2017] [http2:trace2] [pid 527:tid 140004936353536] h2_session.c(1711): [client 127.0.0.1:39984] h2_session(135,BUSY,0): NO_IO event, 0 streams open
[Wed Aug 30 07:56:05.052556 2017] [http2:debug] [pid 527:tid 140004936353536] h2_session.c(1612): [client 127.0.0.1:39984] AH03078: h2_session(135,BUSY,0): transit [BUSY] -- no io (keepalive) --> [IDLE]
[Wed Aug 30 07:56:05.052558 2017] [http2:trace3] [pid 527:tid 140004936353536] h2_session.c(2082): [client 127.0.0.1:39984] h2_session(135,IDLE,0): sync, stutter 1-sec, 0 streams open
[Wed Aug 30 07:56:05.052560 2017] [http2:trace1] [pid 527:tid 140004936353536] h2_filter.c(144): [client 127.0.0.1:39984] h2_session(135): read, BLOCK_READ, mode=0, readbytes=65536
[Wed Aug 30 07:56:05.053536 2017] [http2:trace2] [pid 527:tid 140004936353536] h2_filter.c(92): [client 127.0.0.1:39984] bb_dump(135): RAW_in(HEAP[67])
[Wed Aug 30 07:56:05.053548 2017] [http2:debug] [pid 527:tid 140004936353536] h2_session.c(339): [client 127.0.0.1:39984] AH03066: h2_session(135,IDLE,0): recv FRAME[SETTINGS[length=12, stream=0]], frames=1/7 (r/s)
[Wed Aug 30 07:56:05.053551 2017] [http2:trace2] [pid 527:tid 140004936353536] h2_session.c(411): [client 127.0.0.1:39984] h2_session(135,IDLE,0): on_frame_rcv SETTINGS[length=12, stream=0]
[Wed Aug 30 07:56:05.053553 2017] [http2:debug] [pid 527:tid 140004936353536] h2_session.c(339): [client 127.0.0.1:39984] AH03066: h2_session(135,IDLE,0): recv FRAME[SETTINGS[ack=1, stream=0]], frames=2/7 (r/s)
[Wed Aug 30 07:56:05.053554 2017] [http2:trace2] [pid 527:tid 140004936353536] h2_session.c(411): [client 127.0.0.1:39984] h2_session(135,IDLE,0): on_frame_rcv SETTINGS[ack=1, stream=0]
[Wed Aug 30 07:56:05.053557 2017] [http2:debug] [pid 527:tid 140004936353536] h2_session.c(339): [client 127.0.0.1:39984] AH03066: h2_session(135,IDLE,0): recv FRAME[RST_STREAM[length=4, flags=0, stream=2]], frames=3/7 (r/s)
[Wed Aug 30 07:56:05.053558 2017] [http2:debug] [pid 527:tid 140004936353536] h2_session.c(383): [client 127.0.0.1:39984] AH03067: h2_stream(135-2): RST_STREAM by client, errror=8
[Wed Aug 30 07:56:05.053560 2017] [http2:trace2] [pid 527:tid 140004936353536] h2_filter.c(63): [client 127.0.0.1:39984] h2_session(135,IDLE,0): fed 67 bytes to nghttp2, 67 read
[Wed Aug 30 07:56:05.053562 2017] [http2:trace1] [pid 527:tid 140004936353536] h2_filter.c(144): [client 127.0.0.1:39984] h2_session(135): read, NONBLOCK_READ, mode=0, readbytes=65536
[Wed Aug 30 07:56:05.053563 2017] [http2:trace1] [pid 527:tid 140004936353536] h2_filter.c(189): (70014)End of file found: [client 127.0.0.1:39984] h2_session(135): read
[Wed Aug 30 07:56:05.053565 2017] [http2:debug] [pid 527:tid 140004936353536] h2_session.c(1612): [client 127.0.0.1:39984] AH03078: h2_session(135,IDLE,0): transit [IDLE] -- data read --> [BUSY]
[Wed Aug 30 07:56:05.053571 2017] [http2:trace1] [pid 527:tid 140004936353536] h2_filter.c(144): [client 127.0.0.1:39984] h2_session(135): read, NONBLOCK_READ, mode=0, readbytes=65536
[Wed Aug 30 07:56:05.053572 2017] [http2:trace1] [pid 527:tid 140004936353536] h2_filter.c(189): (70014)End of file found: [client 127.0.0.1:39984] h2_session(135): read
[Wed Aug 30 07:56:05.053573 2017] [http2:trace1] [pid 527:tid 140004936353536] h2_session.c(1532): (70014)End of file found: [client 127.0.0.1:39984] h2_session(135,BUSY,0): input gone
[Wed Aug 30 07:56:05.053575 2017] [http2:debug] [pid 527:tid 140004936353536] h2_session.c(1675): [client 127.0.0.1:39984] AH03401: h2_session(135,BUSY,0): conn error -> shutdown
[Wed Aug 30 07:56:05.053577 2017] [http2:debug] [pid 527:tid 140004936353536] h2_session.c(543): [client 127.0.0.1:39984] AH03068: h2_session(135,BUSY,0): sent FRAME[SETTINGS[ack=1, stream=0]], frames=4/8 (r/s)
[Wed Aug 30 07:56:05.053579 2017] [http2:debug] [pid 527:tid 140004936353536] h2_session.c(543): [client 127.0.0.1:39984] AH03068: h2_session(135,BUSY,0): sent FRAME[GOAWAY[error=0, reason='', last_stream=1]], frames=4/9 (r/s)
[Wed Aug 30 07:56:05.053582 2017] [http2:trace2] [pid 527:tid 140004936353536] h2_conn_io.c(121): [client 127.0.0.1:39984] h2_session(135)-out: heap[26] flush 
[Wed Aug 30 07:56:05.053600 2017] [http2:debug] [pid 527:tid 140004936353536] h2_session.c(668): [client 127.0.0.1:39984] AH03069: h2_session(135,BUSY,0): sent GOAWAY, err=0, msg=
[Wed Aug 30 07:56:05.053603 2017] [http2:debug] [pid 527:tid 140004936353536] h2_session.c(1612): [client 127.0.0.1:39984] AH03078: h2_session(135,BUSY,0): transit [BUSY] -- local goaway --> [DONE]
[Wed Aug 30 07:56:05.053605 2017] [http2:trace2] [pid 527:tid 140004936353536] h2_mplx.c(1239): [client 127.0.0.1:39984] h2_mplx(135): dispatch events
[Wed Aug 30 07:56:05.053618 2017] [http2:trace3] [pid 527:tid 140004936353536] h2_session.c(2258): [client 127.0.0.1:39984] h2_session(135,DONE,0): process returns
[Wed Aug 30 07:56:05.053620 2017] [http2:debug] [pid 527:tid 140004936353536] h2_conn.c(227): (70014)End of file found: [client 127.0.0.1:39984] AH03045: h2_session(135,DONE,0): process, closing conn
[Wed Aug 30 07:56:05.053636 2017] [http2:trace1] [pid 527:tid 140004936353536] h2_session.c(2276): [client 127.0.0.1:39984] h2_session(135,DONE,0): pre_close
[Wed Aug 30 07:56:05.053638 2017] [http2:trace1] [pid 527:tid 140004936353536] h2_session.c(678): [client 127.0.0.1:39984] h2_session(135,DONE,0): pool_cleanup
[Wed Aug 30 07:56:05.053639 2017] [http2:debug] [pid 527:tid 140004936353536] h2_session.c(1612): [client 127.0.0.1:39984] AH03078: h2_session(135,DONE,0): transit [DONE] -- pre_close --> [CLEANUP]
[Wed Aug 30 07:56:05.053643 2017] [http2:trace1] [pid 527:tid 140004936353536] h2_ngn_shed.c(143): [client 127.0.0.1:39984] AH03394: h2_ngn_shed(135): abort
[Wed Aug 30 07:56:05.053645 2017] [http2:trace1] [pid 527:tid 140004936353536] h2_mplx.c(485): [client 127.0.0.1:39984] h2_mplx(135): released
```

**Comment by uhliarik** [comment]
Data from NOT working test on ppc64le.

tcp dump:
```
07:13:19.818981 IP localhost.39974 > localhost.http: Flags [P.], seq 981287544:981287712, ack 1346426002, win 342, options [nop,nop,TS val 9745758 ecr 9745757], length 168: HTTP: GET /http2.html HTTP/1.1
E....,@.@.D..........&.P:}BxP@.....V.......
...^...]GET /http2.html HTTP/1.1
Host: 127.0.0.1
User-Agent: curl/7.47.1
Accept: */*
Connection: Upgrade, HTTP2-Settings
Upgrade: h2c
HTTP2-Settings: AAMAAABkAAQAAP__

................
07:13:19.819634 IP localhost.http > localhost.39974: Flags [P.], seq 1:72, ack 168, win 350, options [nop,nop,TS val 9745758 ecr 9745758], length 71: HTTP: HTTP/1.1 101 Switching Protocols
E..{a.@.@............P.&P@..:}C ...^.o.....
...^...^HTTP/1.1 101 Switching Protocols
Upgrade: h2c
Connection: Upgrade

................
07:13:19.819759 IP localhost.http > localhost.39974: Flags [P.], seq 72:100, ack 168, win 350, options [nop,nop,TS val 9745758 ecr 9745758], length 28: HTTP
E..Pa.@.@............P.&P@..:}C ...^.D.....
...^...^..............d.............................
07:13:19.820091 IP localhost.http > localhost.39974: Flags [P.], seq 100:453, ack 168, win 350, options [nop,nop,TS val 9745759 ecr 9745758], length 353: HTTP
E...a.@.@............P.&P@..:}C ...^.......
..._...^..0...........A...\..p...bQ.*.+..z.%.P.....S.*/*f...\..p...........a..m_J.
e.J...@...p.S...v....r.%.\N..m,.c...)<.....R.....l..Y>.d
Cl...u@..Y..T...........6......WZ..R...J......m......U.W7...Z ...q._.I|...M.j.q........@...N.g...........m......<html>
  <head>
    <title>HTTP/2 Test</title>
  </head>
  <body>
    <img src="fake.jpg">
  </body>
</html>
................
07:13:19.820287 IP localhost.http > localhost.39974: Flags [P.], seq 453:552, ack 168, win 350, options [nop,nop,TS val 9745759 ecr 9745759], length 99: HTTP
E...a.@.@............P.&P@.V:}C ...^.......
..._..._..=.......a..Y>.d
Cl...u@..Y............B.....?#..........20_.5#..t............This is a fake JPEG
................
07:13:19.820800 IP localhost.39974 > localhost.http: Flags [P.], seq 168:192, ack 552, win 350, options [nop,nop,TS val 9745759 ecr 9745759], length 24: HTTP
E..L.1@.@.Ex.........&.P:}C P@.....^.@.....
..._..._PRI * HTTP/2.0

SM

................
07:13:19.820807 IP localhost.39974 > localhost.http: Flags [P.], seq 192:213, ack 552, win 350, options [nop,nop,TS val 9745759 ecr 9745759], length 21: HTTP
E..I.2@.@.Ez.........&.P:}C8P@.....^.=.....
..._..._..............d......................
07:13:19.820811 IP localhost.39974 > localhost.http: Flags [P.], seq 213:222, ack 552, win 350, options [nop,nop,TS val 9745759 ecr 9745759], length 9: HTTP
E..=.3@.@.E..........&.P:}CMP@.....^.1.....
..._..._.........2.html HTTP/1.1
07:13:19.820814 IP localhost.39974 > localhost.http: Flags [P.], seq 222:235, ack 552, win 350, options [nop,nop,TS val 9745759 ecr 9745759], length 13: HTTP
E..A.4@.@.E..........&.P:}CVP@.....^.5.....
..._..._.............Switching Protoc
07:13:19.821274 IP localhost.http > localhost.39974: Flags [P.], seq 552:578, ack 236, win 350, options [nop,nop,TS val 9745760 ecr 9745759], length 26: HTTP
E..Na.@.@............P.&P@..:}Cd...^.B.....
...`..._..........................................
```


trace8 output:
```
[Wed Aug 30 07:55:55.088536 2017] [http2:trace3] [pid 16121:tid 4396344656528] h2_conn.c(145): h2_workers: min=25 max=37, mthrpchild=25, idle_secs=600
[Wed Aug 30 07:55:55.352785 2017] [http2:trace1] [pid 16103:tid 4395873857664] h2_h2.c(591): [client 127.0.0.1:53096] h2_h2, process_conn
[Wed Aug 30 07:55:55.352831 2017] [http2:trace1] [pid 16103:tid 4395873857664] h2_h2.c(605): [client 127.0.0.1:53096] h2_h2, process_conn, new connection using protocol 'http/1.1', direct=1, tls acceptable=1
[Wed Aug 30 07:55:55.352887 2017] [http2:trace2] [pid 16103:tid 4395873857664] h2_h2.c(642): [client 127.0.0.1:53096] h2_h2, not detected in 24 bytes: GET /http2.html HTTP/1.1
[Wed Aug 30 07:55:55.352905 2017] [http2:trace1] [pid 16103:tid 4395873857664] h2_h2.c(662): [client 127.0.0.1:53096] h2_h2, declined
[Wed Aug 30 07:55:55.353159 2017] [http2:trace1] [pid 16103:tid 4395873857664] h2_switch.c(117): [client 127.0.0.1:53096] proposing protocol 'h2c'
[Wed Aug 30 07:55:55.353258 2017] [http2:trace1] [pid 16103:tid 4395873857664] h2_switch.c(150): [client 127.0.0.1:53096] switching protocol to 'h2c'
[Wed Aug 30 07:55:55.353294 2017] [http2:trace4] [pid 16103:tid 4395873857664] h2_conn_io.c(155): [client 127.0.0.1:53096] h2_conn_io(0): init, buffering=0, warmup_size=0, cd_secs=0.000000
[Wed Aug 30 07:55:55.353345 2017] [http2:debug] [pid 16103:tid 4395873857664] h2_session.c(877): [client 127.0.0.1:53096] AH03200: h2_session(0,INIT,0): created, max_streams=100, stream_mem=32768, workers_limit=6, workers_max=37, push_diary(type=1,N=256)
[Wed Aug 30 07:55:55.353359 2017] [http2:trace3] [pid 16103:tid 4395873857664] h2_session.c(1992): [client 127.0.0.1:53096] h2_session(0,INIT,0): process start, async=0
[Wed Aug 30 07:55:55.353377 2017] [http2:debug] [pid 16103:tid 4395873857664] h2_session.c(928): [client 127.0.0.1:53096] AH03070: upgrading h2c session with HTTP2-Settings: AAMAAABkAAQAAP__ ->  0  3  0  0  0 64  0  4  0  0 ff ff  (12)
[Wed Aug 30 07:55:55.353393 2017] [http2:debug] [pid 16103:tid 4395873857664] h2_session.c(339): [client 127.0.0.1:53096] AH03066: h2_session(0,INIT,0): recv FRAME[SETTINGS[length=12, stream=0]], frames=0/0 (r/s)
[Wed Aug 30 07:55:55.353402 2017] [http2:trace2] [pid 16103:tid 4395873857664] h2_session.c(411): [client 127.0.0.1:53096] h2_session(0,INIT,0): on_frame_rcv SETTINGS[length=12, stream=0]
[Wed Aug 30 07:55:55.353422 2017] [http2:debug] [pid 16103:tid 4395873857664] h2_stream.c(547): [client 127.0.0.1:53096] AH03082: h2_stream(0-1,IDLE): created
[Wed Aug 30 07:55:55.353432 2017] [http2:trace2] [pid 16103:tid 4395873857664] h2_session.c(1850): [client 127.0.0.1:53096] h2_stream(0-1,IDLE): entered state
[Wed Aug 30 07:55:55.353457 2017] [http2:debug] [pid 16103:tid 4395873857664] h2_stream.c(637): [client 127.0.0.1:53096] AH03058: h2_stream(0-1,IDLE): set_request_rec GET host=http://127.0.0.1/http2.html
[Wed Aug 30 07:55:55.353472 2017] [http2:trace1] [pid 16103:tid 4395873857664] h2_stream.c(300): [client 127.0.0.1:53096] h2_stream(0-1,IDLE): transit to [OPEN]
[Wed Aug 30 07:55:55.353480 2017] [http2:trace2] [pid 16103:tid 4395873857664] h2_session.c(1850): [client 127.0.0.1:53096] h2_stream(0-1,OPEN): entered state
[Wed Aug 30 07:55:55.353488 2017] [http2:trace1] [pid 16103:tid 4395873857664] h2_stream.c(300): [client 127.0.0.1:53096] h2_stream(0-1,OPEN): transit to [HALF_CLOSED_REMOTE]
[Wed Aug 30 07:55:55.353496 2017] [http2:trace1] [pid 16103:tid 4395873857664] h2_stream.c(210): [client 127.0.0.1:53096] h2_stream(0-1,HALF_CLOSED_REMOTE): closing input
[Wed Aug 30 07:55:55.353502 2017] [http2:trace2] [pid 16103:tid 4395873857664] h2_session.c(1850): [client 127.0.0.1:53096] h2_stream(0-1,HALF_CLOSED_REMOTE): entered state
[Wed Aug 30 07:55:55.353509 2017] [http2:debug] [pid 16103:tid 4395873857664] h2_session.c(970): [client 127.0.0.1:53096] AH03201: h2_session(0,INIT,1): start, INITIAL_WINDOW_SIZE=65535, MAX_CONCURRENT_STREAMS=100
[Wed Aug 30 07:55:55.353521 2017] [http2:debug] [pid 16103:tid 4395873857664] h2_session.c(2023): [client 127.0.0.1:53096] AH03079: h2_session(0,INIT,1): started on hp-moonshot-02-c19.khw.lab.eng.bos.redhat.com:80
[Wed Aug 30 07:55:55.353529 2017] [http2:debug] [pid 16103:tid 4395873857664] h2_session.c(1612): [client 127.0.0.1:53096] AH03078: h2_session(0,INIT,1): transit [INIT] -- init --> [BUSY]
[Wed Aug 30 07:55:55.353538 2017] [http2:trace1] [pid 16103:tid 4395873857664] h2_filter.c(144): [client 127.0.0.1:53096] h2_session(0): read, NONBLOCK_READ, mode=0, readbytes=65536
[Wed Aug 30 07:55:55.353589 2017] [http2:trace2] [pid 16103:tid 4395873857664] h2_filter.c(92): [client 127.0.0.1:53096] bb_dump(0): RAW_in(HEAP[45])
[Wed Aug 30 07:55:55.353624 2017] [http2:debug] [pid 16103:tid 4395873857664] h2_session.c(339): [client 127.0.0.1:53096] AH03066: h2_session(0,BUSY,1): recv FRAME[SETTINGS[length=12, stream=0]], frames=1/0 (r/s)
[Wed Aug 30 07:55:55.353646 2017] [http2:trace2] [pid 16103:tid 4395873857664] h2_session.c(411): [client 127.0.0.1:53096] h2_session(0,BUSY,1): on_frame_rcv SETTINGS[length=12, stream=0]
[Wed Aug 30 07:55:55.353654 2017] [http2:trace2] [pid 16103:tid 4395873857664] h2_filter.c(63): [client 127.0.0.1:53096] h2_session(0,BUSY,1): fed 45 bytes to nghttp2, 45 read
[Wed Aug 30 07:55:55.353662 2017] [http2:trace1] [pid 16103:tid 4395873857664] h2_filter.c(144): [client 127.0.0.1:53096] h2_session(0): read, NONBLOCK_READ, mode=0, readbytes=65536
[Wed Aug 30 07:55:55.353674 2017] [http2:trace2] [pid 16103:tid 4395873857664] h2_filter.c(92): [client 127.0.0.1:53096] bb_dump(0): RAW_in()
[Wed Aug 30 07:55:55.353682 2017] [http2:trace1] [pid 16103:tid 4395873857664] h2_stream.c(599): [client 127.0.0.1:53096] h2_stream(0-1,HALF_CLOSED_REMOTE): schedule GET http://127.0.0.1/http2.html chunked=0
[Wed Aug 30 07:55:55.353708 2017] [http2:trace1] [pid 16103:tid 4395873857664] h2_mplx.c(697): [client 127.0.0.1:53096] h2_stream(0-1,HALF_CLOSED_REMOTE): process, added to q
[Wed Aug 30 07:55:55.353718 2017] [http2:trace2] [pid 16103:tid 4395873857664] h2_mplx.c(1239): [client 127.0.0.1:53096] h2_mplx(0): dispatch events
[Wed Aug 30 07:55:55.353732 2017] [http2:debug] [pid 16103:tid 4395873857664] h2_session.c(543): [client 127.0.0.1:53096] AH03068: h2_session(0,BUSY,1): sent FRAME[SETTINGS[length=6, stream=0]], frames=2/1 (r/s)
[Wed Aug 30 07:55:55.353742 2017] [http2:debug] [pid 16103:tid 4395873857664] h2_session.c(543): [client 127.0.0.1:53096] AH03068: h2_session(0,BUSY,1): sent FRAME[SETTINGS[ack=1, stream=0]], frames=2/2 (r/s)
[Wed Aug 30 07:55:55.353759 2017] [http2:debug] [pid 16103:tid 4395873857664] h2_session.c(543): [client 127.0.0.1:53096] AH03068: h2_session(0,BUSY,1): sent FRAME[WINDOW_UPDATE[stream=0, incr=2147418112]], frames=2/3 (r/s)
[Wed Aug 30 07:55:55.353753 2017] [http2:trace3] [pid 16103:tid 4395999162496] h2_conn.c(282): [client 127.0.0.1:53096] h2_stream(0-1): create slave
[Wed Aug 30 07:55:55.353772 2017] [http2:trace2] [pid 16103:tid 4395873857664] h2_conn_io.c(121): [client 127.0.0.1:53096] h2_session(0)-out: heap[37] flush 
[Wed Aug 30 07:55:55.353817 2017] [http2:trace2] [pid 16103:tid 4395999162496] h2_conn.c(349): [client 127.0.0.1:53096] h2_stream(0-1): created slave
[Wed Aug 30 07:55:55.353829 2017] [http2:trace1] [pid 16103:tid 4395873857664] h2_filter.c(144): [client 127.0.0.1:53096] h2_session(0): read, NONBLOCK_READ, mode=0, readbytes=65536
[Wed Aug 30 07:55:55.353839 2017] [http2:trace2] [pid 16103:tid 4395999162496] h2_task.c(491): [client 127.0.0.1:53096] h2_h2, pre_connection, found stream task
[Wed Aug 30 07:55:55.353850 2017] [http2:trace2] [pid 16103:tid 4395873857664] h2_filter.c(92): [client 127.0.0.1:53096] bb_dump(0): RAW_in()
[Wed Aug 30 07:55:55.353859 2017] [http2:trace2] [pid 16103:tid 4395873857664] h2_mplx.c(1239): [client 127.0.0.1:53096] h2_mplx(0): dispatch events
[Wed Aug 30 07:55:55.353864 2017] [http2:trace1] [pid 16103:tid 4395999162496] h2_task.c(620): [client 127.0.0.1:53096] h2_task(0-1): process connection
[Wed Aug 30 07:55:55.353867 2017] [http2:trace2] [pid 16103:tid 4395873857664] h2_session.c(1711): [client 127.0.0.1:53096] h2_session(0,BUSY,1): NO_IO event, 1 streams open
[Wed Aug 30 07:55:55.353874 2017] [http2:trace1] [pid 16103:tid 4395999162496] h2_task.c(712): [client 127.0.0.1:53096] h2_h2, processing request directly
[Wed Aug 30 07:55:55.353879 2017] [http2:trace1] [pid 16103:tid 4395873857664] h2_session.c(1612): [client 127.0.0.1:53096] AH03078: h2_session(0,BUSY,1): transit [BUSY] -- no io --> [WAIT]
[Wed Aug 30 07:55:55.353882 2017] [http2:trace1] [pid 16103:tid 4395999162496] h2_task.c(646): [client 127.0.0.1:53096] h2_task(0-1): create request_rec
[Wed Aug 30 07:55:55.353889 2017] [http2:trace3] [pid 16103:tid 4395873857664] h2_session.c(2211): [client 127.0.0.1:53096] h2_session: wait for data, 10 micros
[Wed Aug 30 07:55:55.353912 2017] [http2:trace3] [pid 16103:tid 4395999162496] h2_h2.c(722): [client 127.0.0.1:53096] h2_task(0-1): adding request filters
[Wed Aug 30 07:55:55.353933 2017] [http2:trace1] [pid 16103:tid 4395999162496] h2_task.c(664): [client 127.0.0.1:53096] h2_task(0-1): start process_request
[Wed Aug 30 07:55:55.353968 2017] [http2:trace2] [pid 16103:tid 4395873857664] h2_mplx.c(619): [client 127.0.0.1:53096] h2_mplx(0): trywait on data for 0.010000 ms)
[Wed Aug 30 07:55:55.353985 2017] [http2:trace1] [pid 16103:tid 4395873857664] h2_session.c(1612): [client 127.0.0.1:53096] AH03078: h2_session(0,WAIT,1): transit [WAIT] -- wait cycle --> [BUSY]
[Wed Aug 30 07:55:55.353994 2017] [http2:trace1] [pid 16103:tid 4395873857664] h2_filter.c(144): [client 127.0.0.1:53096] h2_session(0): read, NONBLOCK_READ, mode=0, readbytes=65536
[Wed Aug 30 07:55:55.354012 2017] [http2:trace2] [pid 16103:tid 4395873857664] h2_filter.c(92): [client 127.0.0.1:53096] bb_dump(0): RAW_in(HEAP[9])
[Wed Aug 30 07:55:55.354023 2017] [http2:debug] [pid 16103:tid 4395873857664] h2_session.c(339): [client 127.0.0.1:53096] AH03066: h2_session(0,BUSY,1): recv FRAME[SETTINGS[ack=1, stream=0]], frames=2/3 (r/s)
[Wed Aug 30 07:55:55.354030 2017] [http2:trace2] [pid 16103:tid 4395873857664] h2_session.c(411): [client 127.0.0.1:53096] h2_session(0,BUSY,1): on_frame_rcv SETTINGS[ack=1, stream=0]
[Wed Aug 30 07:55:55.354036 2017] [http2:trace2] [pid 16103:tid 4395873857664] h2_filter.c(63): [client 127.0.0.1:53096] h2_session(0,BUSY,1): fed 9 bytes to nghttp2, 9 read
[Wed Aug 30 07:55:55.354042 2017] [http2:trace1] [pid 16103:tid 4395873857664] h2_filter.c(144): [client 127.0.0.1:53096] h2_session(0): read, NONBLOCK_READ, mode=0, readbytes=65536
[Wed Aug 30 07:55:55.354059 2017] [http2:trace2] [pid 16103:tid 4395873857664] h2_filter.c(92): [client 127.0.0.1:53096] bb_dump(0): RAW_in()
[Wed Aug 30 07:55:55.354065 2017] [http2:trace2] [pid 16103:tid 4395873857664] h2_mplx.c(1239): [client 127.0.0.1:53096] h2_mplx(0): dispatch events
[Wed Aug 30 07:55:55.354072 2017] [http2:trace1] [pid 16103:tid 4395873857664] h2_filter.c(144): [client 127.0.0.1:53096] h2_session(0): read, NONBLOCK_READ, mode=0, readbytes=65536
[Wed Aug 30 07:55:55.354081 2017] [http2:trace2] [pid 16103:tid 4395873857664] h2_filter.c(92): [client 127.0.0.1:53096] bb_dump(0): RAW_in()
[Wed Aug 30 07:55:55.354079 2017] [http2:trace1] [pid 16103:tid 4395999162496] h2_from_h1.c(525): [client 127.0.0.1:53096] h2_task(0-1): output_filter called
[Wed Aug 30 07:55:55.354087 2017] [http2:trace2] [pid 16103:tid 4395873857664] h2_mplx.c(1239): [client 127.0.0.1:53096] h2_mplx(0): dispatch events
[Wed Aug 30 07:55:55.354099 2017] [http2:trace2] [pid 16103:tid 4395873857664] h2_session.c(1711): [client 127.0.0.1:53096] h2_session(0,BUSY,1): NO_IO event, 1 streams open
[Wed Aug 30 07:55:55.354105 2017] [http2:trace1] [pid 16103:tid 4395873857664] h2_session.c(1612): [client 127.0.0.1:53096] AH03078: h2_session(0,BUSY,1): transit [BUSY] -- no io --> [WAIT]
[Wed Aug 30 07:55:55.354111 2017] [http2:trace3] [pid 16103:tid 4395873857664] h2_session.c(2211): [client 127.0.0.1:53096] h2_session: wait for data, 10 micros
[Wed Aug 30 07:55:55.354114 2017] [http2:trace2] [pid 16103:tid 4395999162496] h2_task.c(61): [client 127.0.0.1:53096] bb_dump(0-1): h2_task send_out(H2HEADERS FILE[109] EOS)
[Wed Aug 30 07:55:55.354125 2017] [http2:trace2] [pid 16103:tid 4395999162496] h2_bucket_beam.c(1275): [client 127.0.0.1:53096] beam(0-1,output,closed=0,aborted=0,empty=1,buf=0): send_out(before)
[Wed Aug 30 07:55:55.354142 2017] [http2:trace2] [pid 16103:tid 4395999162496] h2_bucket_beam.c(1275): [client 127.0.0.1:53096] beam(0-1,output,closed=1,aborted=0,empty=0,buf=109): send_out(after)
[Wed Aug 30 07:55:55.354149 2017] [http2:trace2] [pid 16103:tid 4395999162496] h2_task.c(114): [client 127.0.0.1:53096] h2_task(0-1): send_out done
[Wed Aug 30 07:55:55.354155 2017] [http2:trace2] [pid 16103:tid 4395999162496] h2_task.c(193): [client 127.0.0.1:53096] h2_slave_out(0-1): slave_out leave
[Wed Aug 30 07:55:55.354165 2017] [http2:trace2] [pid 16103:tid 4395999162496] h2_task.c(61): [client 127.0.0.1:53096] bb_dump(0-1): h2_task send_out(EOR)
[Wed Aug 30 07:55:55.354172 2017] [http2:trace2] [pid 16103:tid 4395999162496] h2_bucket_beam.c(1275): [client 127.0.0.1:53096] beam(0-1,output,closed=1,aborted=0,empty=0,buf=109): send_out(before)
[Wed Aug 30 07:55:55.354178 2017] [http2:trace2] [pid 16103:tid 4395999162496] h2_bucket_beam.c(1275): [client 127.0.0.1:53096] beam(0-1,output,closed=1,aborted=0,empty=0,buf=109): send_out(after)
[Wed Aug 30 07:55:55.354184 2017] [http2:trace2] [pid 16103:tid 4395999162496] h2_task.c(114): [client 127.0.0.1:53096] h2_task(0-1): send_out done
[Wed Aug 30 07:55:55.354185 2017] [http2:trace2] [pid 16103:tid 4395873857664] h2_mplx.c(619): [client 127.0.0.1:53096] h2_mplx(0): trywait on data for 0.010000 ms)
[Wed Aug 30 07:55:55.354189 2017] [http2:trace2] [pid 16103:tid 4395999162496] h2_task.c(193): [client 127.0.0.1:53096] h2_slave_out(0-1): slave_out leave
[Wed Aug 30 07:55:55.354196 2017] [http2:trace1] [pid 16103:tid 4395873857664] h2_session.c(1612): [client 127.0.0.1:53096] AH03078: h2_session(0,WAIT,1): transit [WAIT] -- wait cycle --> [BUSY]
[Wed Aug 30 07:55:55.354200 2017] [http2:trace1] [pid 16103:tid 4395999162496] h2_task.c(229): [client 127.0.0.1:53096] h2_slave_in(0-1): read, mode=3, block=1, readbytes=1
[Wed Aug 30 07:55:55.354204 2017] [http2:trace1] [pid 16103:tid 4395873857664] h2_filter.c(144): [client 127.0.0.1:53096] h2_session(0): read, NONBLOCK_READ, mode=0, readbytes=65536
[Wed Aug 30 07:55:55.354207 2017] [http2:trace1] [pid 16103:tid 4395999162496] h2_task.c(259): [client 127.0.0.1:53096] h2_slave_in(0-1): get more data from mplx, block=1, readbytes=1
[Wed Aug 30 07:55:55.354215 2017] [http2:trace2] [pid 16103:tid 4395873857664] h2_filter.c(92): [client 127.0.0.1:53096] bb_dump(0): RAW_in()
[Wed Aug 30 07:55:55.354226 2017] [http2:trace2] [pid 16103:tid 4395873857664] h2_mplx.c(1239): [client 127.0.0.1:53096] h2_mplx(0): dispatch events
[Wed Aug 30 07:55:55.354222 2017] [http2:trace2] [pid 16103:tid 4395999162496] h2_task.c(271): (70014)End of file found: [client 127.0.0.1:53096] h2_slave_in(0-1): read returned
[Wed Aug 30 07:55:55.354232 2017] [http2:trace2] [pid 16103:tid 4395873857664] h2_session.c(1711): [client 127.0.0.1:53096] h2_session(0,BUSY,1): NO_IO event, 1 streams open
[Wed Aug 30 07:55:55.354239 2017] [http2:trace2] [pid 16103:tid 4395999162496] h2_task.c(61): [client 127.0.0.1:53096] bb_dump(0-1): h2_task send_out(FLUSH)
[Wed Aug 30 07:55:55.354240 2017] [http2:trace1] [pid 16103:tid 4395873857664] h2_session.c(1612): [client 127.0.0.1:53096] AH03078: h2_session(0,BUSY,1): transit [BUSY] -- no io --> [WAIT]
[Wed Aug 30 07:55:55.354247 2017] [http2:trace2] [pid 16103:tid 4395999162496] h2_bucket_beam.c(1275): [client 127.0.0.1:53096] beam(0-1,output,closed=1,aborted=0,empty=0,buf=109): send_out(before)
[Wed Aug 30 07:55:55.354250 2017] [http2:trace3] [pid 16103:tid 4395873857664] h2_session.c(2211): [client 127.0.0.1:53096] h2_session: wait for data, 20 micros
[Wed Aug 30 07:55:55.354255 2017] [http2:trace2] [pid 16103:tid 4395999162496] h2_bucket_beam.c(1275): [client 127.0.0.1:53096] beam(0-1,output,closed=1,aborted=0,empty=0,buf=109): send_out(after)
[Wed Aug 30 07:55:55.354262 2017] [http2:trace2] [pid 16103:tid 4395999162496] h2_task.c(114): [client 127.0.0.1:53096] h2_task(0-1): send_out done
[Wed Aug 30 07:55:55.354267 2017] [http2:debug] [pid 16103:tid 4395999162496] h2_task.c(86): [client 127.0.0.1:53096] AH03348: h2_task(0-1): open output to GET 127.0.0.1 /http2.html
[Wed Aug 30 07:55:55.354273 2017] [http2:trace2] [pid 16103:tid 4395999162496] h2_bucket_beam.c(1275): [client 127.0.0.1:53096] beam(0-1,output,closed=1,aborted=0,empty=0,buf=109): out_open
[Wed Aug 30 07:55:55.354291 2017] [http2:trace2] [pid 16103:tid 4395999162496] h2_task.c(193): [client 127.0.0.1:53096] h2_slave_out(0-1): slave_out leave
[Wed Aug 30 07:55:55.354299 2017] [http2:trace1] [pid 16103:tid 4395999162496] h2_task.c(673): [client 127.0.0.1:53096] h2_task(0-1): process_request done
[Wed Aug 30 07:55:55.354298 2017] [http2:trace2] [pid 16103:tid 4395873857664] h2_mplx.c(619): [client 127.0.0.1:53096] h2_mplx(0): trywait on data for 0.020000 ms)
[Wed Aug 30 07:55:55.354305 2017] [http2:trace1] [pid 16103:tid 4395999162496] h2_task.c(634): [client 127.0.0.1:53096] h2_task(0-1): processing done
[Wed Aug 30 07:55:55.354313 2017] [http2:trace1] [pid 16103:tid 4395999162496] h2_mplx.c(792): [client 127.0.0.1:53096] h2_mplx(0): task(0-1) done
[Wed Aug 30 07:55:55.354312 2017] [http2:trace1] [pid 16103:tid 4395873857664] h2_session.c(1612): [client 127.0.0.1:53096] AH03078: h2_session(0,WAIT,1): transit [WAIT] -- data read --> [BUSY]
[Wed Aug 30 07:55:55.354318 2017] [http2:trace2] [pid 16103:tid 4395999162496] h2_mplx.c(590): [client 127.0.0.1:53096] h2_mplx(0-1): close
[Wed Aug 30 07:55:55.354323 2017] [http2:trace1] [pid 16103:tid 4395873857664] h2_filter.c(144): [client 127.0.0.1:53096] h2_session(0): read, NONBLOCK_READ, mode=0, readbytes=65536
[Wed Aug 30 07:55:55.354325 2017] [http2:trace2] [pid 16103:tid 4395999162496] h2_bucket_beam.c(1275): [client 127.0.0.1:53096] beam(0-1,output,closed=1,aborted=0,empty=0,buf=109): out_close
[Wed Aug 30 07:55:55.354334 2017] [http2:trace2] [pid 16103:tid 4395999162496] h2_mplx.c(823): [client 127.0.0.1:53096] h2_mplx(0-1): request done, 0.502000 ms elapsed
[Wed Aug 30 07:55:55.354338 2017] [http2:trace2] [pid 16103:tid 4395873857664] h2_filter.c(92): [client 127.0.0.1:53096] bb_dump(0): RAW_in()
[Wed Aug 30 07:55:55.354341 2017] [http2:trace2] [pid 16103:tid 4395999162496] h2_mplx.c(853): [client 127.0.0.1:53096] h2_stream(0-1,HALF_CLOSED_REMOTE): task_done, stream open
[Wed Aug 30 07:55:55.354345 2017] [http2:trace2] [pid 16103:tid 4395873857664] h2_mplx.c(1239): [client 127.0.0.1:53096] h2_mplx(0): dispatch events
[Wed Aug 30 07:55:55.354355 2017] [http2:trace2] [pid 16103:tid 4395873857664] h2_session.c(1433): [client 127.0.0.1:53096] h2_stream(0-1,HALF_CLOSED_REMOTE): on_resume
[Wed Aug 30 07:55:55.354365 2017] [http2:trace2] [pid 16103:tid 4395873857664] h2_stream.c(180): [client 127.0.0.1:53096] h2_stream(0-1,HALF_CLOSED_REMOTE): out-buffer(add_data())
[Wed Aug 30 07:55:55.354373 2017] [http2:trace2] [pid 16103:tid 4395873857664] h2_stream.c(180): [client 127.0.0.1:53096] h2_stream(0-1,HALF_CLOSED_REMOTE): out-buffer(pre())
[Wed Aug 30 07:55:55.354387 2017] [http2:trace2] [pid 16103:tid 4395873857664] h2_stream.c(180): [client 127.0.0.1:53096] h2_stream(0-1,HALF_CLOSED_REMOTE): out-buffer(post(H2HEADERS FILE[109] EOS FLUSH))
[Wed Aug 30 07:55:55.354397 2017] [http2:trace2] [pid 16103:tid 4395873857664] h2_stream.c(180): [client 127.0.0.1:53096] h2_stream(0-1,HALF_CLOSED_REMOTE): out-buffer(add_data(H2HEADERS FILE[109] EOS FLUSH))
[Wed Aug 30 07:55:55.354404 2017] [http2:trace1] [pid 16103:tid 4395873857664] h2_stream.c(814): [client 127.0.0.1:53096] h2_stream(0-1,HALF_CLOSED_REMOTE): prep, -> response 200
[Wed Aug 30 07:55:55.354412 2017] [http2:trace1] [pid 16103:tid 4395873857664] h2_stream.c(919): [client 127.0.0.1:53096] h2_stream(0-1,HALF_CLOSED_REMOTE): prepare, no data
[Wed Aug 30 07:55:55.354418 2017] [http2:trace2] [pid 16103:tid 4395873857664] h2_session.c(1440): (11)Resource temporarily unavailable: [client 127.0.0.1:53096] h2_stream(0-1,HALF_CLOSED_REMOTE): prepared len=0, eos=0
[Wed Aug 30 07:55:55.354438 2017] [http2:trace2] [pid 16103:tid 4395873857664] h2_session.c(1280): [client 127.0.0.1:53096] h2_stream(0-1,HALF_CLOSED_REMOTE): on_headers
[Wed Aug 30 07:55:55.354446 2017] [http2:debug] [pid 16103:tid 4395873857664] h2_session.c(1312): [client 127.0.0.1:53096] AH03073: h2_stream(0-1,HALF_CLOSED_REMOTE): submit response 200, REMOTE_WINDOW_SIZE=65535
[Wed Aug 30 07:55:55.354487 2017] [http2:trace1] [pid 16103:tid 4395873857664] h2_push.c(677): [client 127.0.0.1:53096] push_diary_update: adding PUSH /fake.jpg
[Wed Aug 30 07:55:55.354501 2017] [http2:trace1] [pid 16103:tid 4395873857664] h2_stream.c(960): [client 127.0.0.1:53096] h2_stream(0-1,HALF_CLOSED_REMOTE): found 1 push candidates
[Wed Aug 30 07:55:55.354521 2017] [http2:debug] [pid 16103:tid 4395873857664] h2_session.c(1103): [client 127.0.0.1:53096] AH03076: h2_stream(0-1,HALF_CLOSED_REMOTE): SERVER_PUSH 2 for GET /fake.jpg on 1
[Wed Aug 30 07:55:55.354532 2017] [http2:debug] [pid 16103:tid 4395873857664] h2_stream.c(547): [client 127.0.0.1:53096] AH03082: h2_stream(0-2,IDLE): created
[Wed Aug 30 07:55:55.354538 2017] [http2:trace2] [pid 16103:tid 4395873857664] h2_session.c(1850): [client 127.0.0.1:53096] h2_stream(0-2,IDLE): entered state
[Wed Aug 30 07:55:55.354577 2017] [http2:debug] [pid 16103:tid 4395873857664] h2_session.c(543): [client 127.0.0.1:53096] AH03068: h2_session(0,BUSY,2): sent FRAME[PUSH_PROMISE[length=48, hend=1, stream=1]], frames=3/4 (r/s)
[Wed Aug 30 07:55:55.354589 2017] [http2:trace1] [pid 16103:tid 4395873857664] h2_stream.c(410): [client 127.0.0.1:53096] h2_stream(0-2,IDLE): send frame 5, eos=0
[Wed Aug 30 07:55:55.354595 2017] [http2:trace1] [pid 16103:tid 4395873857664] h2_stream.c(300): [client 127.0.0.1:53096] h2_stream(0-2,IDLE): transit to [RESERVED_LOCAL]
[Wed Aug 30 07:55:55.354601 2017] [http2:trace1] [pid 16103:tid 4395873857664] h2_stream.c(210): [client 127.0.0.1:53096] h2_stream(0-2,RESERVED_LOCAL): closing input
[Wed Aug 30 07:55:55.354627 2017] [http2:trace2] [pid 16103:tid 4395873857664] h2_session.c(1850): [client 127.0.0.1:53096] h2_stream(0-2,RESERVED_LOCAL): entered state
[Wed Aug 30 07:55:55.354668 2017] [http2:debug] [pid 16103:tid 4395873857664] h2_session.c(543): [client 127.0.0.1:53096] AH03068: h2_session(0,BUSY,2): sent FRAME[HEADERS[length=169, hend=1, stream=1, eos=0]], frames=3/5 (r/s)
[Wed Aug 30 07:55:55.354677 2017] [http2:trace1] [pid 16103:tid 4395873857664] h2_stream.c(410): [client 127.0.0.1:53096] h2_stream(0-1,HALF_CLOSED_REMOTE): send frame 1, eos=0
[Wed Aug 30 07:55:55.354719 2017] [http2:trace2] [pid 16103:tid 4395873857664] h2_stream.c(180): [client 127.0.0.1:53096] h2_stream(0-1,HALF_CLOSED_REMOTE): out-buffer(add_data(FILE[109] EOS FLUSH))
[Wed Aug 30 07:55:55.354728 2017] [http2:trace1] [pid 16103:tid 4395873857664] h2_stream.c(914): [client 127.0.0.1:53096] h2_stream(0-1,HALF_CLOSED_REMOTE): prepare, len=109 eos=1
[Wed Aug 30 07:55:55.354735 2017] [http2:trace2] [pid 16103:tid 4395873857664] h2_session.c(1045): [client 127.0.0.1:53096] h2_stream(0-1,HALF_CLOSED_REMOTE): prepared no_copy, len=109, eos=1
[Wed Aug 30 07:55:55.354743 2017] [http2:trace2] [pid 16103:tid 4395873857664] h2_session.c(468): [client 127.0.0.1:53096] h2_stream(0-1,HALF_CLOSED_REMOTE): send_data_cb for 109 bytes
[Wed Aug 30 07:55:55.354751 2017] [http2:trace2] [pid 16103:tid 4395873857664] h2_stream.c(945): [client 127.0.0.1:53096] h2_stream(0-1,HALF_CLOSED_REMOTE): read_to, len=109 eos=1
[Wed Aug 30 07:55:55.354760 2017] [http2:debug] [pid 16103:tid 4395873857664] h2_session.c(543): [client 127.0.0.1:53096] AH03068: h2_session(0,BUSY,2): sent FRAME[DATA[length=109, flags=1, stream=1, padlen=0]], frames=3/6 (r/s)
[Wed Aug 30 07:55:55.354766 2017] [http2:trace1] [pid 16103:tid 4395873857664] h2_stream.c(410): [client 127.0.0.1:53096] h2_stream(0-1,HALF_CLOSED_REMOTE): send frame 0, eos=1
[Wed Aug 30 07:55:55.354771 2017] [http2:trace1] [pid 16103:tid 4395873857664] h2_stream.c(300): [client 127.0.0.1:53096] h2_stream(0-1,HALF_CLOSED_REMOTE): transit to [CLOSED]
[Wed Aug 30 07:55:55.354776 2017] [http2:trace1] [pid 16103:tid 4395873857664] h2_stream.c(210): [client 127.0.0.1:53096] h2_stream(0-1,CLOSED): closing input
[Wed Aug 30 07:55:55.354782 2017] [http2:trace2] [pid 16103:tid 4395873857664] h2_session.c(1850): [client 127.0.0.1:53096] h2_stream(0-1,CLOSED): entered state
[Wed Aug 30 07:55:55.354792 2017] [http2:trace2] [pid 16103:tid 4395873857664] h2_stream.c(180): [client 127.0.0.1:53096] h2_stream(0-1,CLOSED): out-buffer(add_data())
[Wed Aug 30 07:55:55.354799 2017] [http2:trace2] [pid 16103:tid 4395873857664] h2_stream.c(180): [client 127.0.0.1:53096] h2_stream(0-1,CLOSED): out-buffer(pre())
[Wed Aug 30 07:55:55.354805 2017] [http2:trace2] [pid 16103:tid 4395873857664] h2_stream.c(180): [client 127.0.0.1:53096] h2_stream(0-1,CLOSED): out-buffer(post())
[Wed Aug 30 07:55:55.354811 2017] [http2:trace1] [pid 16103:tid 4395873857664] h2_stream.c(914): [client 127.0.0.1:53096] h2_stream(0-1,CLOSED): prepare, len=0 eos=1
[Wed Aug 30 07:55:55.354816 2017] [http2:trace2] [pid 16103:tid 4395873857664] h2_session.c(1440): [client 127.0.0.1:53096] h2_stream(0-1,CLOSED): prepared len=0, eos=1
[Wed Aug 30 07:55:55.354822 2017] [http2:debug] [pid 16103:tid 4395873857664] h2_session.c(1462): [client 127.0.0.1:53096] AH02936: h2_stream(0-1,CLOSED): resumed
[Wed Aug 30 07:55:55.354830 2017] [http2:trace1] [pid 16103:tid 4395873857664] h2_filter.c(144): [client 127.0.0.1:53096] h2_session(0): read, NONBLOCK_READ, mode=0, readbytes=65536
[Wed Aug 30 07:55:55.354844 2017] [http2:trace2] [pid 16103:tid 4395873857664] h2_filter.c(92): [client 127.0.0.1:53096] bb_dump(0): RAW_in()
[Wed Aug 30 07:55:55.354851 2017] [http2:trace1] [pid 16103:tid 4395873857664] h2_stream.c(599): [client 127.0.0.1:53096] h2_stream(0-2,RESERVED_LOCAL): schedule GET http://127.0.0.1/fake.jpg chunked=0
[Wed Aug 30 07:55:55.354869 2017] [http2:trace1] [pid 16103:tid 4395873857664] h2_mplx.c(697): [client 127.0.0.1:53096] h2_stream(0-2,RESERVED_LOCAL): process, added to q
[Wed Aug 30 07:55:55.354883 2017] [http2:trace2] [pid 16103:tid 4395873857664] h2_mplx.c(1239): [client 127.0.0.1:53096] h2_mplx(0): dispatch events
[Wed Aug 30 07:55:55.354885 2017] [http2:trace3] [pid 16103:tid 4395999162496] h2_conn.c(282): [client 127.0.0.1:53096] h2_stream(0-2): create slave
[Wed Aug 30 07:55:55.354892 2017] [http2:trace2] [pid 16103:tid 4395873857664] h2_session.c(1711): [client 127.0.0.1:53096] h2_session(0,BUSY,1): NO_IO event, 1 streams open
[Wed Aug 30 07:55:55.354899 2017] [http2:trace2] [pid 16103:tid 4395999162496] h2_conn.c(349): [client 127.0.0.1:53096] h2_stream(0-2): created slave
[Wed Aug 30 07:55:55.354906 2017] [http2:trace2] [pid 16103:tid 4395873857664] h2_conn_io.c(121): [client 127.0.0.1:53096] h2_session(0)-out: heap[244] file[109] flush h2eos flush 
[Wed Aug 30 07:55:55.354920 2017] [http2:trace2] [pid 16103:tid 4395999162496] h2_task.c(491): [client 127.0.0.1:53096] h2_h2, pre_connection, found stream task
[Wed Aug 30 07:55:55.354932 2017] [http2:trace1] [pid 16103:tid 4395999162496] h2_task.c(620): [client 127.0.0.1:53096] h2_task(0-2): process connection
[Wed Aug 30 07:55:55.354939 2017] [http2:trace1] [pid 16103:tid 4395999162496] h2_task.c(712): [client 127.0.0.1:53096] h2_h2, processing request directly
[Wed Aug 30 07:55:55.354945 2017] [http2:trace1] [pid 16103:tid 4395999162496] h2_task.c(646): [client 127.0.0.1:53096] h2_task(0-2): create request_rec
[Wed Aug 30 07:55:55.354963 2017] [http2:trace3] [pid 16103:tid 4395999162496] h2_h2.c(722): [client 127.0.0.1:53096] h2_task(0-2): adding request filters
[Wed Aug 30 07:55:55.354982 2017] [http2:trace1] [pid 16103:tid 4395999162496] h2_task.c(664): [client 127.0.0.1:53096] h2_task(0-2): start process_request
[Wed Aug 30 07:55:55.354989 2017] [http2:trace2] [pid 16103:tid 4395873857664] h2_stream.c(342): [client 127.0.0.1:53096] h2_stream(0-1,CLOSED): dispatch event 3
[Wed Aug 30 07:55:55.354998 2017] [http2:trace1] [pid 16103:tid 4395873857664] h2_stream.c(300): [client 127.0.0.1:53096] h2_stream(0-1,CLOSED): transit to [CLEANUP]
[Wed Aug 30 07:55:55.355005 2017] [http2:trace2] [pid 16103:tid 4395873857664] h2_session.c(1850): [client 127.0.0.1:53096] h2_stream(0-1,CLEANUP): entered state
[Wed Aug 30 07:55:55.355012 2017] [http2:trace2] [pid 16103:tid 4395873857664] h2_mplx.c(493): [client 127.0.0.1:53096] h2_stream(0-1,CLEANUP): cleanup
[Wed Aug 30 07:55:55.355024 2017] [http2:trace1] [pid 16103:tid 4395873857664] h2_session.c(1612): [client 127.0.0.1:53096] AH03078: h2_session(0,BUSY,1): transit [BUSY] -- no io --> [WAIT]
[Wed Aug 30 07:55:55.355033 2017] [http2:trace3] [pid 16103:tid 4395873857664] h2_session.c(2211): [client 127.0.0.1:53096] h2_session: wait for data, 10 micros
[Wed Aug 30 07:55:55.355041 2017] [http2:debug] [pid 16103:tid 4395873857664] h2_bucket_beam.c(1275): [client 127.0.0.1:53096] beam(0-1,output,closed=1,aborted=1,empty=1,buf=0): AH03385: h2_task_destroy, reuse slave
[Wed Aug 30 07:55:55.355050 2017] [http2:trace2] [pid 16103:tid 4395873857664] h2_bucket_beam.c(1275): [client 127.0.0.1:53096] beam(0-1,output,closed=1,aborted=1,empty=1,buf=0): task_destroy
[Wed Aug 30 07:55:55.355121 2017] [http2:trace3] [pid 16103:tid 4395873857664] h2_stream.c(579): [client 127.0.0.1:53096] h2_stream(0-1,CLEANUP): destroy
[Wed Aug 30 07:55:55.355194 2017] [http2:trace1] [pid 16103:tid 4395999162496] h2_from_h1.c(525): [client 127.0.0.1:53096] h2_task(0-2): output_filter called
[Wed Aug 30 07:55:55.355223 2017] [http2:trace2] [pid 16103:tid 4395999162496] h2_task.c(61): [client 127.0.0.1:53096] bb_dump(0-2): h2_task send_out(H2HEADERS FILE[20] EOS)
[Wed Aug 30 07:55:55.355231 2017] [http2:trace2] [pid 16103:tid 4395999162496] h2_bucket_beam.c(1275): [client 127.0.0.1:53096] beam(0-2,output,closed=0,aborted=0,empty=1,buf=0): send_out(before)
[Wed Aug 30 07:55:55.355240 2017] [http2:trace2] [pid 16103:tid 4395999162496] h2_bucket_beam.c(1275): [client 127.0.0.1:53096] beam(0-2,output,closed=1,aborted=0,empty=0,buf=20): send_out(after)
[Wed Aug 30 07:55:55.355247 2017] [http2:trace2] [pid 16103:tid 4395999162496] h2_task.c(114): [client 127.0.0.1:53096] h2_task(0-2): send_out done
[Wed Aug 30 07:55:55.355252 2017] [http2:trace2] [pid 16103:tid 4395999162496] h2_task.c(193): [client 127.0.0.1:53096] h2_slave_out(0-2): slave_out leave
[Wed Aug 30 07:55:55.355261 2017] [http2:trace2] [pid 16103:tid 4395999162496] h2_task.c(61): [client 127.0.0.1:53096] bb_dump(0-2): h2_task send_out(EOR)
[Wed Aug 30 07:55:55.355267 2017] [http2:trace2] [pid 16103:tid 4395999162496] h2_bucket_beam.c(1275): [client 127.0.0.1:53096] beam(0-2,output,closed=1,aborted=0,empty=0,buf=20): send_out(before)
[Wed Aug 30 07:55:55.355279 2017] [http2:trace2] [pid 16103:tid 4395999162496] h2_bucket_beam.c(1275): [client 127.0.0.1:53096] beam(0-2,output,closed=1,aborted=0,empty=0,buf=20): send_out(after)
[Wed Aug 30 07:55:55.355286 2017] [http2:trace2] [pid 16103:tid 4395999162496] h2_task.c(114): [client 127.0.0.1:53096] h2_task(0-2): send_out done
[Wed Aug 30 07:55:55.355291 2017] [http2:trace2] [pid 16103:tid 4395999162496] h2_task.c(193): [client 127.0.0.1:53096] h2_slave_out(0-2): slave_out leave
[Wed Aug 30 07:55:55.355297 2017] [http2:trace1] [pid 16103:tid 4395999162496] h2_task.c(229): [client 127.0.0.1:53096] h2_slave_in(0-2): read, mode=3, block=1, readbytes=1
[Wed Aug 30 07:55:55.355302 2017] [http2:trace1] [pid 16103:tid 4395999162496] h2_task.c(259): [client 127.0.0.1:53096] h2_slave_in(0-2): get more data from mplx, block=1, readbytes=1
[Wed Aug 30 07:55:55.355307 2017] [http2:trace2] [pid 16103:tid 4395999162496] h2_task.c(271): (70014)End of file found: [client 127.0.0.1:53096] h2_slave_in(0-2): read returned
[Wed Aug 30 07:55:55.355317 2017] [http2:trace2] [pid 16103:tid 4395999162496] h2_task.c(61): [client 127.0.0.1:53096] bb_dump(0-2): h2_task send_out(FLUSH)
[Wed Aug 30 07:55:55.355316 2017] [http2:trace2] [pid 16103:tid 4395873857664] h2_mplx.c(619): [client 127.0.0.1:53096] h2_mplx(0): trywait on data for 0.010000 ms)
[Wed Aug 30 07:55:55.355323 2017] [http2:trace2] [pid 16103:tid 4395999162496] h2_bucket_beam.c(1275): [client 127.0.0.1:53096] beam(0-2,output,closed=1,aborted=0,empty=0,buf=20): send_out(before)
[Wed Aug 30 07:55:55.355329 2017] [http2:trace1] [pid 16103:tid 4395873857664] h2_session.c(1612): [client 127.0.0.1:53096] AH03078: h2_session(0,WAIT,1): transit [WAIT] -- wait cycle --> [BUSY]
[Wed Aug 30 07:55:55.355330 2017] [http2:trace2] [pid 16103:tid 4395999162496] h2_bucket_beam.c(1275): [client 127.0.0.1:53096] beam(0-2,output,closed=1,aborted=0,empty=0,buf=20): send_out(after)
[Wed Aug 30 07:55:55.355337 2017] [http2:trace1] [pid 16103:tid 4395873857664] h2_filter.c(144): [client 127.0.0.1:53096] h2_session(0): read, NONBLOCK_READ, mode=0, readbytes=65536
[Wed Aug 30 07:55:55.355338 2017] [http2:trace2] [pid 16103:tid 4395999162496] h2_task.c(114): [client 127.0.0.1:53096] h2_task(0-2): send_out done
[Wed Aug 30 07:55:55.355346 2017] [http2:debug] [pid 16103:tid 4395999162496] h2_task.c(86): [client 127.0.0.1:53096] AH03348: h2_task(0-2): open output to GET 127.0.0.1 /fake.jpg
[Wed Aug 30 07:55:55.355352 2017] [http2:trace2] [pid 16103:tid 4395999162496] h2_bucket_beam.c(1275): [client 127.0.0.1:53096] beam(0-2,output,closed=1,aborted=0,empty=0,buf=20): out_open
[Wed Aug 30 07:55:55.355356 2017] [http2:trace2] [pid 16103:tid 4395873857664] h2_filter.c(92): [client 127.0.0.1:53096] bb_dump(0): RAW_in(HEAP[13])
[Wed Aug 30 07:55:55.355359 2017] [http2:trace2] [pid 16103:tid 4395999162496] h2_task.c(193): [client 127.0.0.1:53096] h2_slave_out(0-2): slave_out leave
[Wed Aug 30 07:55:55.355365 2017] [http2:trace1] [pid 16103:tid 4395999162496] h2_task.c(673): [client 127.0.0.1:53096] h2_task(0-2): process_request done
[Wed Aug 30 07:55:55.355366 2017] [http2:debug] [pid 16103:tid 4395873857664] h2_session.c(339): [client 127.0.0.1:53096] AH03066: h2_session(0,BUSY,1): recv FRAME[RST_STREAM[length=4, flags=0, stream=2]], frames=3/6 (r/s)
[Wed Aug 30 07:55:55.355371 2017] [http2:trace1] [pid 16103:tid 4395999162496] h2_task.c(634): [client 127.0.0.1:53096] h2_task(0-2): processing done
[Wed Aug 30 07:55:55.355374 2017] [http2:debug] [pid 16103:tid 4395873857664] h2_session.c(383): [client 127.0.0.1:53096] AH03067: h2_stream(0-2): RST_STREAM by client, errror=8
[Wed Aug 30 07:55:55.355377 2017] [http2:trace1] [pid 16103:tid 4395999162496] h2_mplx.c(792): [client 127.0.0.1:53096] h2_mplx(0): task(0-2) done
[Wed Aug 30 07:55:55.355380 2017] [http2:debug] [pid 16103:tid 4395873857664] h2_session.c(265): [client 127.0.0.1:53096] AH03065: h2_stream(0-2,RESERVED_LOCAL): closing with err=8 cancel
[Wed Aug 30 07:55:55.355382 2017] [http2:trace2] [pid 16103:tid 4395999162496] h2_mplx.c(590): [client 127.0.0.1:53096] h2_mplx(0-2): close
[Wed Aug 30 07:55:55.355390 2017] [http2:trace1] [pid 16103:tid 4395873857664] h2_stream.c(617): [client 127.0.0.1:53096] h2_stream(0-2,RESERVED_LOCAL): reset, error=8
[Wed Aug 30 07:55:55.355392 2017] [http2:trace2] [pid 16103:tid 4395999162496] h2_bucket_beam.c(1275): [client 127.0.0.1:53096] beam(0-2,output,closed=1,aborted=1,empty=0,buf=20): out_close
[Wed Aug 30 07:55:55.355397 2017] [http2:trace2] [pid 16103:tid 4395873857664] h2_stream.c(342): [client 127.0.0.1:53096] h2_stream(0-2,RESERVED_LOCAL): dispatch event 2
[Wed Aug 30 07:55:55.355399 2017] [http2:trace2] [pid 16103:tid 4395999162496] h2_mplx.c(823): [client 127.0.0.1:53096] h2_mplx(0-2): request done, 0.483000 ms elapsed
[Wed Aug 30 07:55:55.355404 2017] [http2:trace1] [pid 16103:tid 4395873857664] h2_stream.c(300): [client 127.0.0.1:53096] h2_stream(0-2,RESERVED_LOCAL): transit to [CLOSED]
[Wed Aug 30 07:55:55.355406 2017] [http2:trace2] [pid 16103:tid 4395999162496] h2_mplx.c(853): [client 127.0.0.1:53096] h2_stream(0-2,RESERVED_LOCAL): task_done, stream open
[Wed Aug 30 07:55:55.355410 2017] [http2:trace1] [pid 16103:tid 4395873857664] h2_stream.c(210): [client 127.0.0.1:53096] h2_stream(0-2,CLOSED): closing input
[Wed Aug 30 07:55:55.355415 2017] [http2:trace2] [pid 16103:tid 4395873857664] h2_session.c(1850): [client 127.0.0.1:53096] h2_stream(0-2,CLOSED): entered state
[Wed Aug 30 07:55:55.355424 2017] [http2:trace2] [pid 16103:tid 4395873857664] h2_filter.c(63): [client 127.0.0.1:53096] h2_session(0,BUSY,0): fed 13 bytes to nghttp2, 13 read
[Wed Aug 30 07:55:55.355432 2017] [http2:trace1] [pid 16103:tid 4395873857664] h2_filter.c(144): [client 127.0.0.1:53096] h2_session(0): read, NONBLOCK_READ, mode=0, readbytes=65536
[Wed Aug 30 07:55:55.355444 2017] [http2:trace2] [pid 16103:tid 4395873857664] h2_filter.c(92): [client 127.0.0.1:53096] bb_dump(0): RAW_in()
[Wed Aug 30 07:55:55.355451 2017] [http2:trace2] [pid 16103:tid 4395873857664] h2_mplx.c(1239): [client 127.0.0.1:53096] h2_mplx(0): dispatch events
[Wed Aug 30 07:55:55.355458 2017] [http2:trace2] [pid 16103:tid 4395873857664] h2_session.c(1433): [client 127.0.0.1:53096] h2_stream(0-2,CLOSED): on_resume
[Wed Aug 30 07:55:55.355464 2017] [http2:trace2] [pid 16103:tid 4395873857664] h2_session.c(1440): (104)Connection reset by peer: [client 127.0.0.1:53096] h2_stream(0-2,CLOSED): prepared len=0, eos=1
[Wed Aug 30 07:55:55.355474 2017] [http2:debug] [pid 16103:tid 4395873857664] h2_session.c(1454): [client 127.0.0.1:53096] AH03466: h2_stream(0-2,CLOSED): no response, RST_STREAM
[Wed Aug 30 07:55:55.355480 2017] [http2:trace1] [pid 16103:tid 4395873857664] h2_stream.c(617): [client 127.0.0.1:53096] h2_stream(0-2,CLOSED): reset, error=1
[Wed Aug 30 07:55:55.355485 2017] [http2:trace2] [pid 16103:tid 4395873857664] h2_stream.c(342): [client 127.0.0.1:53096] h2_stream(0-2,CLOSED): dispatch event 2
[Wed Aug 30 07:55:55.355490 2017] [http2:trace2] [pid 16103:tid 4395873857664] h2_stream.c(354): [client 127.0.0.1:53096] h2_stream(0-2,CLOSED): non-state event 2
[Wed Aug 30 07:55:55.355499 2017] [http2:debug] [pid 16103:tid 4395873857664] h2_session.c(543): [client 127.0.0.1:53096] AH03068: h2_session(0,BUSY,0): sent FRAME[RST_STREAM[length=4, flags=0, stream=2]], frames=4/7 (r/s)
[Wed Aug 30 07:55:55.355509 2017] [http2:trace2] [pid 16103:tid 4395873857664] h2_conn_io.c(121): [client 127.0.0.1:53096] h2_session(0)-out: h2eos heap[13] flush 
[Wed Aug 30 07:55:55.355517 2017] [http2:trace2] [pid 16103:tid 4395873857664] h2_stream.c(342): [client 127.0.0.1:53096] h2_stream(0-2,CLOSED): dispatch event 3
[Wed Aug 30 07:55:55.355523 2017] [http2:trace1] [pid 16103:tid 4395873857664] h2_stream.c(300): [client 127.0.0.1:53096] h2_stream(0-2,CLOSED): transit to [CLEANUP]
[Wed Aug 30 07:55:55.355528 2017] [http2:trace2] [pid 16103:tid 4395873857664] h2_session.c(1850): [client 127.0.0.1:53096] h2_stream(0-2,CLEANUP): entered state
[Wed Aug 30 07:55:55.355536 2017] [http2:trace2] [pid 16103:tid 4395873857664] h2_mplx.c(493): [client 127.0.0.1:53096] h2_stream(0-2,CLEANUP): cleanup
[Wed Aug 30 07:55:55.355644 2017] [http2:trace1] [pid 16103:tid 4395873857664] h2_filter.c(144): [client 127.0.0.1:53096] h2_session(0): read, NONBLOCK_READ, mode=0, readbytes=65536
[Wed Aug 30 07:55:55.355670 2017] [http2:trace1] [pid 16103:tid 4395873857664] h2_filter.c(189): (70014)End of file found: [client 127.0.0.1:53096] h2_session(0): read
[Wed Aug 30 07:55:55.355679 2017] [http2:trace1] [pid 16103:tid 4395873857664] h2_session.c(1532): (70014)End of file found: [client 127.0.0.1:53096] h2_session(0,BUSY,0): input gone
[Wed Aug 30 07:55:55.355686 2017] [http2:debug] [pid 16103:tid 4395873857664] h2_session.c(1675): [client 127.0.0.1:53096] AH03401: h2_session(0,BUSY,0): conn error -> shutdown
[Wed Aug 30 07:55:55.355699 2017] [http2:debug] [pid 16103:tid 4395873857664] h2_session.c(543): [client 127.0.0.1:53096] AH03068: h2_session(0,BUSY,0): sent FRAME[GOAWAY[error=0, reason='', last_stream=1]], frames=4/8 (r/s)
[Wed Aug 30 07:55:55.355713 2017] [http2:trace2] [pid 16103:tid 4395873857664] h2_conn_io.c(121): [client 127.0.0.1:53096] h2_session(0)-out: heap[17] flush 
[Wed Aug 30 07:55:55.355729 2017] [http2:debug] [pid 16103:tid 4395873857664] h2_conn_io.c(281): (32)Broken pipe: [client 127.0.0.1:53096] AH03044: h2_conn_io(0): pass_out brigade 17 bytes
[Wed Aug 30 07:55:55.355740 2017] [http2:debug] [pid 16103:tid 4395873857664] h2_session.c(668): [client 127.0.0.1:53096] AH03069: h2_session(0,BUSY,0): sent GOAWAY, err=0, msg=
[Wed Aug 30 07:55:55.355749 2017] [http2:debug] [pid 16103:tid 4395873857664] h2_session.c(1612): [client 127.0.0.1:53096] AH03078: h2_session(0,BUSY,0): transit [BUSY] -- local goaway --> [DONE]
[Wed Aug 30 07:55:55.355757 2017] [http2:trace2] [pid 16103:tid 4395873857664] h2_mplx.c(1239): [client 127.0.0.1:53096] h2_mplx(0): dispatch events
[Wed Aug 30 07:55:55.355765 2017] [http2:debug] [pid 16103:tid 4395873857664] h2_bucket_beam.c(1275): [client 127.0.0.1:53096] beam(0-2,output,closed=1,aborted=1,empty=0,buf=20): AH03385: h2_task_destroy, reuse slave
[Wed Aug 30 07:55:55.355772 2017] [http2:trace2] [pid 16103:tid 4395873857664] h2_bucket_beam.c(1275): [client 127.0.0.1:53096] beam(0-2,output,closed=1,aborted=1,empty=0,buf=20): task_destroy
[Wed Aug 30 07:55:55.355849 2017] [http2:trace3] [pid 16103:tid 4395873857664] h2_stream.c(579): [client 127.0.0.1:53096] h2_stream(0-2,CLEANUP): destroy
[Wed Aug 30 07:55:55.355864 2017] [http2:trace3] [pid 16103:tid 4395873857664] h2_session.c(2258): [client 127.0.0.1:53096] h2_session(0,DONE,0): process returns
[Wed Aug 30 07:55:55.355872 2017] [http2:debug] [pid 16103:tid 4395873857664] h2_conn.c(227): (70014)End of file found: [client 127.0.0.1:53096] AH03045: h2_session(0,DONE,0): process, closing conn
[Wed Aug 30 07:55:55.355910 2017] [http2:trace1] [pid 16103:tid 4395873857664] h2_session.c(2276): [client 127.0.0.1:53096] h2_session(0,DONE,0): pre_close
[Wed Aug 30 07:55:55.355919 2017] [http2:trace1] [pid 16103:tid 4395873857664] h2_session.c(678): [client 127.0.0.1:53096] h2_session(0,DONE,0): pool_cleanup
[Wed Aug 30 07:55:55.355925 2017] [http2:debug] [pid 16103:tid 4395873857664] h2_session.c(1612): [client 127.0.0.1:53096] AH03078: h2_session(0,DONE,0): transit [DONE] -- pre_close --> [CLEANUP]
[Wed Aug 30 07:55:55.355931 2017] [http2:trace1] [pid 16103:tid 4395873857664] h2_ngn_shed.c(143): [client 127.0.0.1:53096] AH03394: h2_ngn_shed(0): abort
[Wed Aug 30 07:55:55.355937 2017] [http2:trace1] [pid 16103:tid 4395873857664] h2_mplx.c(485): [client 127.0.0.1:53096] h2_mplx(0): released
```

**Comment by uhliarik** [comment]
On ppc64le, I could see these lines, which look weird (client closes connection after fake.jpg is offered):

```

[Wed Aug 30 07:55:55.355346 2017] [http2:debug] [pid 16103:tid 4395999162496] h2_task.c(86): [client 127.0.0.1:53096] AH03348: h2_task(0-2): open output to GET 127.0.0.1 /fake.jpg
[Wed Aug 30 07:55:55.355352 2017] [http2:trace2] [pid 16103:tid 4395999162496] h2_bucket_beam.c(1275): [client 127.0.0.1:53096] beam(0-2,output,closed=1,aborted=0,empty=0,buf=20): out_open
[Wed Aug 30 07:55:55.355356 2017] [http2:trace2] [pid 16103:tid 4395873857664] h2_filter.c(92): [client 127.0.0.1:53096] bb_dump(0): RAW_in(HEAP[13])
[Wed Aug 30 07:55:55.355359 2017] [http2:trace2] [pid 16103:tid 4395999162496] h2_task.c(193): [client 127.0.0.1:53096] h2_slave_out(0-2): slave_out leave
[Wed Aug 30 07:55:55.355365 2017] [http2:trace1] [pid 16103:tid 4395999162496] h2_task.c(673): [client 127.0.0.1:53096] h2_task(0-2): process_request done
[Wed Aug 30 07:55:55.355366 2017] [http2:debug] [pid 16103:tid 4395873857664] h2_session.c(339): [client 127.0.0.1:53096] AH03066: h2_session(0,BUSY,1): recv FRAME[RST_STREAM[length=4, flags=0, stream=2]], frames=3/6 (r/s)
[Wed Aug 30 07:55:55.355371 2017] [http2:trace1] [pid 16103:tid 4395999162496] h2_task.c(634): [client 127.0.0.1:53096] h2_task(0-2): processing done
[Wed Aug 30 07:55:55.355374 2017] [http2:debug] [pid 16103:tid 4395873857664] h2_session.c(383): [client 127.0.0.1:53096] AH03067: h2_stream(0-2): RST_STREAM by client, errror=8
[Wed Aug 30 07:55:55.355377 2017] [http2:trace1] [pid 16103:tid 4395999162496] h2_mplx.c(792): [client 127.0.0.1:53096] h2_mplx(0): task(0-2) done
[Wed Aug 30 07:55:55.355380 2017] [http2:debug] [pid 16103:tid 4395873857664] h2_session.c(265): [client 127.0.0.1:53096] AH03065: h2_stream(0-2,RESERVED_LOCAL): closing with err=8 cancel
[Wed Aug 30 07:55:55.355382 2017] [http2:trace2] [pid 16103:tid 4395999162496] h2_mplx.c(590): [client 127.0.0.1:53096] h2_mplx(0-2): close
[Wed Aug 30 07:55:55.355390 2017] [http2:trace1] [pid 16103:tid 4395873857664] h2_stream.c(617): [client 127.0.0.1:53096] h2_stream(0-2,RESERVED_LOCAL): reset, error=8
[Wed Aug 30 07:55:55.355392 2017] [http2:trace2] [pid 16103:tid 4395999162496] h2_bucket_beam.c(1275): [client 127.0.0.1:53096] beam(0-2,output,closed=1,aborted=1,empty=0,buf=20): out_close
```

I also tried to access testing page from x86_64 system, to be sure, bug is not in client (curl).

**Comment by icing** [comment]
Thanks @uhliarik for the detailed logs. Sorry, that I only find the time now to look into this.

What I miss from the description is exactly *how* you determine that on one platform it fails and what is success on the other.

```curl``` as a client does not support PUSH (afaik) and, as you see in the logs, it sends a RST_STREAM on pushed resources. Now, depending on the timing, the RST_STREAM may arrive before or after the fake.jpg is sent. So, you'll see it in one tcp dump, but not the other. 

Would that explain your observations?

**Comment by uhliarik** [comment]
Hi @icing, thank you for your response. I was not aware, that curl doesn't support server PUSH. I thought, it supports server PUSH, since I could see pushed image in tcp dump. But as you said, it is probably caused by timing. Thank you for your comment -> I'm closing this issue.
